id,adhikarana_id,field_type,content,language
"5907","Adhikarana_077","notes","Dvaita exegesis: Madhva uses scriptural structure itself as proof of duality. The persistent two-fold teaching in Upanishads isn't pedagogical convenience but reflects metaphysical reality.",
"5908","Adhikarana_077","references","Mundaka Upanishad 3.1.1, Brihadaranyaka Upanishad 3.7, Shvetashvatara Upanishad 1.6",
"5909","Adhikarana_078","topic","यावत् - The jiva's embodied existence continues until liberation (moksha)",
"5910","Adhikarana_078","samshaya","Does the jiva achieve liberation while still embodied, or only after final death?",
"5911","Adhikarana_078","purvapaksha","Advaita: Jnana immediately liberates; the body may continue but bondage ceases instantly (jivanmukti).",
"5912","Adhikarana_078","siddhanta","According to Dvaita: Complete liberation occurs only after the body falls (videhamukti). Madhva's position: (1) As long as the body exists, some connection with prakriti remains, hence complete freedom is impossible, (2) True moksha means reaching Vaikuntha and experiencing direct vision of Vishnu—this happens only after death, (3) While living, the devotee may have profound realization and freedom from fear, but full liberation awaits, (4) The jiva continues in embodied state 'until' (yavat) the prarabdha karma exhausts. Madhva does not accept jivanmukti in the Advaita sense. The highest living state is para-bhakti (supreme devotion), which culminates in videha-mukti after death. Then the jiva reaches Vaikuntha for eternal blissful service to Vishnu.",
"5913","Adhikarana_078","notes","Dvaita eschatology: No merging, no immediate liberation. The jiva's journey completes in Vaikuntha with eternal individual existence in Vishnu's presence. Moksha is reaching Vishnu, not becoming Vishnu.",
"5914","Adhikarana_078","references","Chandogya Upanishad 6.14.2, Bhagavad Gita 4.9, 8.5",
"5915","Adhikarana_079","topic","पुंस्त्व - The jiva is atomic in size (anu-parimana) yet pervades the body through consciousness",
"5916","Adhikarana_079","samshaya","What is the size of the jiva? Is it all-pervading like Brahman, or limited?",
"5917","Adhikarana_079","purvapaksha","Jiva is all-pervading (vibhu) like Brahman, or is the size of the body.",
"5918","Adhikarana_079","siddhanta","According to Dvaita: The jiva is atomic in size (anu). Madhva's reasoning: (1) If jiva were all-pervading, it would experience all bodies simultaneously—but each jiva experiences only one body, (2) If jiva were body-sized, it couldn't transmigrate to different-sized bodies, (3) Jiva is anu (atomic), residing in the heart region, but its consciousness (jnana-guna) pervades the entire body, (4) This explains how we feel sensations throughout the body though the jiva itself is located in one place. The atomic jiva differs from all-pervading Vishnu. Vishnu is vibhu (all-pervading), jivas are anu (atomic). This distinction is eternal and real. The jiva's atomic nature proves it is limited and dependent, never capable of independent omnipresence like Vishnu.",
"5919","Adhikarana_079","notes","Dvaita unique doctrine: Atomic jiva is distinctive Madhva teaching. It reconciles jiva's limitedness with its body-wide experience through the distinction between jiva's svarupa (atomic) and its guna (consciousness quality that pervades).",
"5920","Adhikarana_079","references","Mundaka Upanishad 3.1.9, Shvetashvatara Upanishad 5.8-9",
"5921","Adhikarana_080","topic","कर्तृत्व - The jiva is a real agent (karta) of actions, though dependent on Vishnu's permission",
"5922","Adhikarana_080","samshaya","Is the jiva truly the agent of its actions, or is Brahman the sole agent? Does agency create bondage?",
"5923","Adhikarana_080","purvapaksha","Either: (1) Brahman alone acts, jiva is passive (some Vedantic views), or (2) Jiva acts independently without divine involvement (Sankhya-Yoga view).",
"5924","Adhikarana_080","siddhanta","According to Dvaita: Jiva is a real but dependent agent. Madhva's nuanced position: (1) Jiva is the karta (agent)—it genuinely performs actions and experiences results, (2) However, jiva's agency is not independent—every action requires Vishnu's sanction and enabling power, (3) Vishnu, as antaryamin, permits actions aligned with jiva's karma and nature but is not the doer of individual jiva's actions, (4) Good actions arise when jiva aligns with Vishnu's will; evil actions when jiva misuses its limited freedom, (5) Jiva bears moral responsibility for its actions—karma-phala (results) accrue to the jiva, not to Vishnu. This establishes limited agency: jiva is subordinate karta (asvatantra-karta), Vishnu is supreme controller (niyanta). Vishnu enables but doesn't compel; jiva chooses but cannot act without divine permission. This solves the free will problem while maintaining Vishnu's sovereignty.",
"5925","Adhikarana_080","notes","Dvaita theodicy and free will: Madhva's doctrine of limited agency is sophisticated. It avoids both fatalism (jiva has no freedom) and absolute free will (jiva is independent). Jiva has real but constrained agency under Vishnu's governance.",
"5926","Adhikarana_080","references","Bhagavad Gita 3.27, 5.14, 15.15, 18.61, Katha Upanishad 2.2.13",
"5927","Adhikarana_081","topic","अंश - The jiva is not a 'part' (amsha) of Brahman but an eternally distinct entity dependent on Brahman",
"5928","Adhikarana_081","samshaya","When Shruti says jiva is an 'amsha' (part) of Brahman, does this mean jiva is identical with Brahman, or a real fragment, or something else?",
"5929","Adhikarana_081","purvapaksha","Jiva is either: (1) A real part/fragment of Brahman (implying Brahman is divisible), or (2) Identical with Brahman (Advaita), or (3) Reflects Brahman like sparks from fire.",
"5930","Adhikarana_081","siddhanta","According to Dvaita: 'Amsha' means eternally dependent entity, not literal part. Madhva's interpretation: (1) Brahman (Vishnu) is indivisible (akhanda)—calling jiva a 'part' doesn't mean Vishnu is fragmented, (2) 'Amsha' metaphorically indicates jiva's eternal dependence on and subordination to Vishnu, just as parts depend on the whole, (3) Jiva and Vishnu are eternally distinct (bheda), never identical or fragments separated from unity, (4) The relationship is controller-controlled (niyamya-niyamaka), body-soul (sharira-shariri), not whole-part in material sense. Vishnu remains complete and unaffected; jivas exist as eternally dependent conscious beings. This refutes both identity (Advaita) and real partition theories. Madhva's unique position: jivas are real, distinct, eternal, and utterly dependent—not illusions, not parts, not identical.",
"5931","Adhikarana_081","notes","Dvaita subtle metaphysics: This adhikarana shows Madhva's careful exegesis. He maintains Vishnu's absolute unity while affirming jiva's reality and distinction. The amsha doctrine is crucial for Dvaita theology.",
"5932","Adhikarana_081","references","Bhagavad Gita 15.7 ('mamaivamsho jiva-loke'), Brihadaranyaka Upanishad 2.5.19",
"5933","Adhikarana_082","topic","अदृष्ट - Karma (unseen moral force/adrishta) governs jiva's experiences under Vishnu's supervision",
"5934","Adhikarana_082","samshaya","What determines the jiva's experiences of pleasure and pain? Is it arbitrary divine will, karma, or both?",
"5935","Adhikarana_082","purvapaksha","Either karma operates independently without God (Mimamsa-Sankhya view), or God arbitrarily dispenses results without regard to karma (some theistic views).",
"5936","Adhikarana_082","siddhanta","According to Dvaita: Karma operates under Vishnu's governance. Madhva's synthesis: (1) Karma (adrishta/apurva) is real—actions create invisible impressions that determine future experiences, (2) However, karma is not independent or self-executing—Vishnu as antaryamin supervises and administers karmic results, (3) Vishnu ensures perfect justice: each jiva receives exactly what its karma warrants, neither more nor less, (4) Vishnu is not arbitrary or partial—He follows the law of karma but He established that law and maintains it. This resolves the problem: karma explains diversity and suffering (avoiding accusations of divine arbitrariness), while Vishnu's supervision ensures cosmic order and possibility of grace. Madhva's position avoids both mechanical fatalism and divine caprice. This concludes Chapter 2 Pada 3.",
"5937","Adhikarana_082","notes","Dvaita theodicy completion: Karma + Vishnu's supervision = perfect justice system. Neither pure determinism (karma alone) nor pure voluntarism (God's whim alone), but harmonious integration. This completes the entire discussion of creation, jiva nature, and cosmic governance.",
"5938","Adhikarana_082","references","Bhagavad Gita 9.29, Brahma Sutra 2.3.41, Brihadaranyaka Upanishad 3.2.13",
"5939","Adhikarana_083","topic","प्राण - Whether Prana (vital force) is a created entity or is it Brahman itself, and its origin",
"5940","Adhikarana_083","samshaya","Is Prana mentioned in Upanishads an independent uncreated principle, a created entity, or Brahman itself? If created, from where does it originate?",
"5941","Adhikarana_083","purvapaksha","Prana is either Brahman itself (since it's called greatest), or it's an uncreated independent principle like air, or it's the jiva since it experiences.",
"5942","Adhikarana_083","siddhanta","According to Dvaita: Prana (mukhya prana, chief vital force) is a created entity, distinct from both Brahman and jiva. It originates from Vishnu during creation. Madhva establishes: (1) Prana is a real substance (dravya), not mere function - it has specific qualities and performs distinct activities, (2) Prana is created by Vishnu from Himself, making it part of the dependent reality, (3) Prana is insentient (jada) but animated by Vishnu's antaryamin presence, (4) The five vital airs (prana, apana, vyana, udana, samana) are modifications of mukhya prana, (5) Prana is different from jiva - jiva is conscious and eternal, prana is unconscious and created, (6) Prana pervades the body and enables all physiological functions under jiva's directive and Vishnu's ultimate control. The statement 'prana is born from Atman' (Prashnopanishad 3.3) confirms its origin from Vishnu. Prana is Vishnu's shakti manifested as vital energy.",
"5943","Adhikarana_083","notes","Dvaita: Madhva's realistic ontology includes prana as a distinct created principle. Unlike Advaita (which reduces prana to Brahman or maya), Madhva affirms prana's reality as Vishnu's creation. This establishes the complexity of creation - conscious Vishnu, conscious jivas, and various unconscious principles including prana all working in harmony under Vishnu's control.",
"5944","Adhikarana_083","references","Prashnopanishad 3.3, Brihadaranyaka Upanishad 1.3.19-22, Chandogya Upanishad 5.1",
"5945","Adhikarana_084","topic","मनः - Whether the mind (manas) is a sense organ (indriya) or distinct from the sense organs",
"5946","Adhikarana_084","samshaya","Is the mind merely another sense organ like the ten indriyas, or is it a distinct principle? Should it be counted among the indriyas or separately?",
"5947","Adhikarana_084","purvapaksha","Mind is just the eleventh sense organ, functioning like others to perceive its objects (internal thoughts).",
"5948","Adhikarana_084","siddhanta","According to Dvaita: Mind (manas) is distinct from the ten sense organs (five knowledge organs and five action organs) though it shares some characteristics with them. Madhva's position: (1) Mind is ubhayatmaka - it has dual nature, functioning both as knowledge organ and action organ, (2) Mind is the internal organ (antah-karana) coordinating all sense perceptions - no sense can function without mind's attention, (3) Mind is atomic (anu) in size, like the jiva, enabling its singular focus at any moment, (4) Mind is created from sattvic aspect of elements during cosmic creation, (5) Mind is the instrument (karana) through which jiva cognizes and wills, but jiva is the ultimate knower, not the mind, (6) Mind is insentient (jada) - consciousness belongs to jiva alone; mind merely reflects jiva's consciousness like a mirror. Unlike senses which perceive only external objects, mind perceives both external (coordinated through senses) and internal (thoughts, memories, imagination). All mental activities occur under Vishnu's antaryamin control.",
"5949","Adhikarana_084","notes","Dvaita clarity: Madhva maintains clear distinction between conscious jiva and unconscious mind. This refutes Buddhist vijnanavada (consciousness-only) and establishes that mind is a real but inert instrument. The jiva uses mind as its primary instrument for experiencing the world.",
"5950","Adhikarana_084","references","Brihadaranyaka Upanishad 1.5.3, Chandogya Upanishad 7.3.1, Katha Upanishad 1.3.3-4",
"5951","Adhikarana_085","topic","वाक् - Speech (vak) and other action organs are created from elements and are distinct principles",
"5952","Adhikarana_085","samshaya","Are speech and other action organs (karmendriyas) merely functions of prana, or are they distinct created entities? What is their origin?",
"5953","Adhikarana_085","purvapaksha","Speech is just a function of the vital air (prana), not a separate organ. Similarly, other action organs are merely prana in different modes.",
"5954","Adhikarana_085","siddhanta","According to Dvaita: Speech (vak) and the five action organs (karmendriyas - speech, hands, feet, organs of excretion and generation) are distinct created entities, not mere functions of prana. Madhva's teaching: (1) Each action organ has its own specific power (shakti) derived from particular deities - Agni presides over speech, Indra over hands, Vishnu over feet, Yama over excretion, Prajapati over generation, (2) The action organs originate from the rajasic aspect of the five elements during creation, (3) Each organ is a real distinct principle (tattva), though all function in coordination under mind's direction, (4) The organs cannot function without prana's support, but they are not identical to prana - prana energizes, organs execute specific actions, (5) All organs ultimately function under the control of Vishnu as antaryamin - through presiding deities, Vishnu exercises control over each organ's function. The scripture 'From Him (Brahman) speech and prana arise' (Mundaka 2.1.3) confirms their creation from Vishnu. Though distinct, all physiological instruments work in perfect harmony as parts of Vishnu's controlled creation.",
"5955","Adhikarana_085","notes","Dvaita realism: Madhva's detailed ontology recognizes multiple real entities coordinating in bodily function. This opposes reductionism (reducing everything to one principle) and establishes the complex orchestration of Vishnu's creation where multiple dependent principles work in hierarchy.",
"5956","Adhikarana_085","references","Mundaka Upanishad 2.1.3, Brihadaranyaka Upanishad 1.3.2-7, Prashnopanishad 2.3",
"5957","Adhikarana_086","topic","सप्तगति - The seven gates/apertures mentioned in scripture and the enumeration of sense organs",
"5958","Adhikarana_086","samshaya","What are the 'seven gates' of the city (body) mentioned in Upanishads? How many sense organs are there - seven, eleven, or another number?",
"5959","Adhikarana_086","purvapaksha","There are only seven organs corresponding to the seven openings in the head (two eyes, two ears, two nostrils, one mouth).",
"5960","Adhikarana_086","siddhanta","According to Dvaita: The 'seven gates' refer specifically to the seven openings in the head through which knowledge is acquired, but the total number of organs is not limited to seven. Madhva's clarification: (1) The seven gates (sapta dwara) are the seven apertures in the head region - two eyes, two ears, two nostrils, and one mouth, (2) These seven are specifically mentioned because they are primary channels for external knowledge acquisition, (3) However, the complete enumeration includes: eleven organs total - five knowledge organs (jnanendriyas: eye, ear, nose, tongue, skin), five action organs (karmendriyas: speech, hands, feet, excretion, generation), plus mind as the coordinating internal organ, (4) Different scriptural passages emphasize different enumerations based on teaching context - seven when emphasizing knowledge gates, ten when discussing organs alone, eleven including mind, (5) All these organs are Vishnu's creation, instruments for jiva's embodied experience. The Mundaka passage 'two eyes, two ears...' and Chandogya's enumeration are reconciled by understanding contextual emphasis. All organs, regardless of number, function under Vishnu's antaryamin governance.",
"5961","Adhikarana_086","notes","Dvaita: Madhva reconciles apparent contradictions in scriptural numbers through contextual interpretation. This demonstrates sophisticated hermeneutics - scripture's varying enumerations reflect pedagogical emphasis, not contradiction.",
"5962","Adhikarana_086","references","Mundaka Upanishad 2.1.8, Chandogya Upanishad 3.13.8, Prashnopanishad 4.2",
"5963","Adhikarana_087","topic","अणुत्व - Whether the sense organs are atomic (anu) in size or all-pervading",
"5964","Adhikarana_087","samshaya","Are the sense organs atomic in dimension or are they all-pervading throughout the body? What is their actual size/extent?",
"5965","Adhikarana_087","purvapaksha","The organs must be all-pervading since they function throughout the body - skin feels everywhere, etc.",
"5966","Adhikarana_087","siddhanta","According to Dvaita: The internal organ (mind) and the sense organs are atomic (anu-parimana) in essential nature, though their effects extend throughout the body. Madhva's position: (1) Each organ's essential substance (svarupa) is atomic - concentrated at specific locations in the body, (2) The apparent all-pervasiveness is functional, not substantial - skin sensitivity throughout doesn't mean the organ itself is all-pervading, but that its power extends via nerve connections, (3) Mind is specifically atomic, enabling focused attention - if mind were all-pervading, simultaneous awareness of everything would occur, contradicting experience of sequential attention, (4) The organs' atomic nature parallels jiva's atomic nature - both reside at specific locations (heart) but their consciousness/function extends throughout the body, (5) This atomic nature doesn't limit their efficiency - under Vishnu's design, atomic organs perfectly serve their purposes through their extended functional presence. Scriptural statements like 'the atomic organ' and the fact that organs can be individually impaired at specific locations support this view. The atomic instruments serve jiva's embodied experience under Vishnu's perfect orchestration.",
"5967","Adhikarana_087","notes","Dvaita distinctive: Madhva's atomic theory of organs parallels his atomic theory of jiva. This realism distinguishes him from Advaita (all-pervading consciousness) and establishes precise metaphysics of embodied existence.",
"5968","Adhikarana_087","references","Chandogya Upanishad 8.12.4, Katha Upanishad 1.3.4, Mundaka Upanishad 3.1.9",
"5969","Adhikarana_088","topic","मुख्यप्राण - The chief prana (mukhya prana) is distinct from and superior to the sense organs",
"5970","Adhikarana_088","samshaya","Is the chief prana (mukhya prana) the same as the sense organs or distinct from them? What is its status and function?",
"5971","Adhikarana_088","purvapaksha","Mukhya prana is just another name for the aggregate of sense organs, or it's identical to the breathing function.",
"5972","Adhikarana_088","siddhanta","According to Dvaita: Mukhya prana (the chief vital force) is a distinct principle, superior to and independent of the sense organs. Madhva's teaching: (1) Mukhya prana is the primary life-sustaining energy in the body, distinct from the five subsidiary pranas (prana, apana, vyana, udana, samana), (2) The sense organs depend on prana for their functioning - when prana leaves, all organs cease operation, but prana exists independently of organs, (3) In the famous dialogue where organs compete for supremacy (Brihadaranyaka 6.1, Chandogya 5.1), prana is declared greatest because life continues without individual organs but not without prana, (4) Mukhya prana is Vishnu's direct energy maintaining embodied existence - it's the link between jiva and body, enabling the atomic jiva to animate the entire physical form, (5) The five subsidiary vital airs are functional modifications of mukhya prana, each serving specific physiological roles, (6) Prana operates under Vishnu's constant control as antaryamin - it is insentient shakti directed by conscious Vishnu. The Upanishadic teaching 'Prana alone does not leave the dying person' (when it does leave, death occurs) establishes its primacy. Mukhya prana is Vishnu's sustaining power individualized in each body.",
"5973","Adhikarana_088","notes","Dvaita: Madhva's hierarchy places mukhya prana above organs but below jiva and Vishnu. This establishes gradation even among insentient principles - some jada entities (like prana) are more fundamental than others (like organs).",
"5974","Adhikarana_088","references","Brihadaranyaka Upanishad 6.1.7-14, Chandogya Upanishad 5.1.1-15, Prashnopanishad 2.3",
"5975","Adhikarana_089","topic","चक्षुरादि - The eyes and other sense organs originate from elements, not directly from Brahman",
"5976","Adhikarana_089","samshaya","Do the sense organs originate directly from Brahman, or do they arise from the elements? What is the sequence of their creation?",
"5977","Adhikarana_089","purvapaksha","Since all creation originates from Brahman, the organs too come directly from Brahman without intermediate stages.",
"5978","Adhikarana_089","siddhanta","According to Dvaita: The sense organs originate from the elements (bhutas), not directly from Vishnu/Brahman. The creation sequence follows hierarchy. Madhva's teaching: (1) Vishnu first creates the five elements (panchamahabhuta - akasha, vayu, agni, ap, prithvi), (2) From these elements, the subtle organs are formed - each organ derives from specific element(s): eyes from tejas (fire/light), ears from akasha, nose from prithvi (earth), tongue from ap (water), skin from vayu (air), (3) This is mediated creation - Vishnu creates elements, elements produce organs, establishing layered causation, (4) The presiding deities (Surya for eyes, Dik for ears, Ashvins for nose, Varuna for tongue, Vayu for skin) are appointed by Vishnu to govern respective organs, (5) Though ultimately traceable to Vishnu as the supreme cause, the immediate material cause of organs is elemental - this establishes real transformation (parinama) in creation, (6) Mind originates from the sattvic essence of all elements combined. This mediated creation demonstrates Vishnu's systematic methodology - not arbitrary instant creation but orderly sequential manifestation. Each level of reality arises from the previous under Vishnu's governance, maintaining the organic unity of creation.",
"5979","Adhikarana_089","notes","Dvaita realism: Madhva's parinama-vada (real transformation) establishes genuine causation chains. Unlike Advaita's vivarta (apparent causation), Madhva affirms real sequential causation under Vishnu's ultimate control - both intermediate causes and supreme cause are real.",
"5980","Adhikarana_089","references","Taittiriya Upanishad 2.1, Chandogya Upanishad 6.5.4, Brihadaranyaka Upanishad 1.3",
"5981","Adhikarana_090","topic","पञ्चवृत्ति - The five-fold function or division of prana into five vital airs",
"5982","Adhikarana_090","samshaya","Are the five pranas (prana, apana, vyana, udana, samana) five distinct entities or one prana with five functions? How to understand their plurality?",
"5983","Adhikarana_090","purvapaksha","The five pranas are completely distinct entities, each created separately and functioning independently.",
"5984","Adhikarana_090","siddhanta","According to Dvaita: The five vital airs are functional modifications or aspects of the one mukhya prana, not entirely separate entities. Madhva's position: (1) There is one essential prana (mukhya prana) which manifests in five functional modes based on location and activity, (2) The five-fold division: Prana (upward-moving breath, seated in heart/chest), Apana (downward-moving, in lower abdomen), Vyana (pervading throughout body), Udana (ascending, in throat enabling speech), Samana (centered in navel region, aids digestion), (3) These are not five independent substances but one prana performing five distinct physiological functions through different locations and movements in the body, (4) All five depend on mukhya prana - when the chief prana departs at death, all five cease simultaneously, (5) The functional plurality serves the jiva's embodied experience - different bodily activities require differentiated vital support, (6) Under Vishnu's governance as antaryamin, the one prana diversifies its operation for perfect bodily function. The analogy: like one gold shaped into five ornaments, or one actor playing five roles. The scriptural enumeration of five pranas indicates functional distinction within essential unity. This establishes both unity (one prana) and diversity (five functions) in the vital energy system.",
"5985","Adhikarana_090","notes","Dvaita: Madhva's 'functional plurality within essential unity' applies here - one reality with multiple operations. This is distinct from absolute monism (denying plurality) and absolute pluralism (denying unity). Madhva's middle path affirms both.",
"5986","Adhikarana_090","references","Prashnopanishad 3.5-7, Brihadaranyaka Upanishad 1.5.3, Taittiriya Upanishad 1.7",
"5987","Adhikarana_091","topic","प्राणाणुत्व - Whether prana is atomic or all-pervading in dimension",
