id,adhikarana_id,field_type,content,language
"5451","Adhikarana_001","topic","ब्रह्मजिज्ञासा - The inquiry into Brahman and its necessity",
"5452","Adhikarana_001","samshaya","Is inquiry into Brahman necessary? Can liberation be attained through karma alone?",
"5453","Adhikarana_001","purvapaksha","Karma (ritualistic actions) alone is sufficient for liberation. There is no need for knowledge of Brahman.",
"5454","Adhikarana_001","siddhanta","Knowledge of Brahman is essential for liberation. Karma prepares the mind but cannot directly lead to moksha. Therefore, inquiry into Brahman (brahma-jijnasa) is necessary after acquiring the four-fold qualifications.",
"5455","Adhikarana_001","notes","This is the foundational adhikarana establishing the purpose of Vedanta study. The word 'atha' indicates auspicious beginning.",
"5456","Adhikarana_001","references","Bhagavad Gita 4.33-39, Taittiriya Upanishad Bhashya",
"5457","Adhikarana_002","topic","जन्माद्यस्य यतः - The origin, sustenance, and dissolution of the universe and Brahman as the ultimate cause",
"5458","Adhikarana_002","samshaya","What is 'janmadyasya yatah'? Does it refer to Pradhana (primordial matter) or Brahman?",
"5459","Adhikarana_002","purvapaksha","Pradhana (Prakriti), the inert primordial matter of Sankhya philosophy, is the cause of the universe.",
"5460","Adhikarana_002","siddhanta","Brahman alone is both material and efficient cause. Only omniscient Brahman, not inert Pradhana, can create because creation requires knowledge and deliberation (ikshati).",
"5461","Adhikarana_002","notes","This is the lakshana (definition) sutra of Brahman. Establishes Brahman as both intelligent and material cause.",
"5462","Adhikarana_002","references","Taittiriya Upanishad 3.1, Chandogya Upanishad 6.2.1-3",
"5463","Adhikarana_003","topic","शास्त्रयोनित्वम् - The scriptures as the source of knowledge about Brahman",
"5464","Adhikarana_003","samshaya","Can Brahman be known through perception, inference, or other means? Or are scriptures the only source?",
"5465","Adhikarana_003","purvapaksha","Brahman can be known through inference and reasoning, similar to knowing the existence of atoms.",
"5466","Adhikarana_003","siddhanta","The Vedas (shabda pramana) are the only valid means of knowing Brahman. Brahman is beyond perception and inference as it transcends the sensory and intellectual realm.",
"5467","Adhikarana_003","notes","Establishes that scriptural testimony is indispensable for knowledge of Brahman, though reasoning can support scriptural teachings.",
"5468","Adhikarana_003","references","Mundaka Upanishad 3.2.3, Katha Upanishad 2.23",
"5469","Adhikarana_004","topic","समन्वय - The harmony and consistency of all Upanishadic texts in teaching Brahman",
"5470","Adhikarana_004","samshaya","Do all Upanishads teach about Brahman consistently, or do they have different meanings?",
"5471","Adhikarana_004","purvapaksha","Upanishadic texts have diverse teachings and cannot be harmonized to teach one subject.",
"5472","Adhikarana_004","siddhanta","All Upanishads harmoniously (samanvaya) teach about Brahman alone. Apparent differences are reconcilable through proper interpretation.",
"5473","Adhikarana_004","notes","Establishes the unity and consistency of Vedantic teaching across all Upanishads regarding Brahman.",
"5474","Adhikarana_004","references","Chandogya, Brihadaranyaka, and other major Upanishads",
"5475","Adhikarana_005","topic","ईक्षति - The 'seeing' or deliberation of Brahman before creation as mentioned in Chandogya Upanishad",
"5476","Adhikarana_005","samshaya","Does 'It saw' (aikshata) refer to Brahman or Pradhana? Can an inert entity deliberate before creation?",
"5477","Adhikarana_005","purvapaksha","Pradhana, being the material cause, can be the subject of 'seeing' through figurative language.",
"5478","Adhikarana_005","siddhanta","Only Brahman, being conscious, can deliberate (ikshati). The word 'seeing' indicates conscious deliberation, which is impossible for inert Pradhana. The Creator must be intelligent.",
"5479","Adhikarana_005","notes","This adhikarana establishes Brahman as both intelligent and the cause of creation through the argument of conscious deliberation.",
"5480","Adhikarana_005","references","Chandogya Upanishad 6.2.3 - 'tadaikshata'",
"5481","Adhikarana_006","topic","आनन्दमय - Whether the Anandamaya (bliss-sheath) mentioned in Taittiriya Upanishad refers to Brahman or merely to a modification",
"5482","Adhikarana_006","samshaya","Does 'anandamaya' refer to Brahman or to the bliss-sheath (anandamaya kosha), which is just a modification of the mind?",
"5483","Adhikarana_006","purvapaksha","Anandamaya is just the causal body (karana sharira) or innermost sheath, not Brahman itself. The suffix 'mayat' indicates modification, not the essence.",
"5484","Adhikarana_006","siddhanta","Anandamaya is Brahman because the Upanishad describes it with characteristics of Brahman: it is the tail/support (puccha) of other sheaths, it is described as sat-tyam (reality), and the context indicates Brahman. The suffix 'mayat' here means 'abundant in' (bliss), not 'modification of'.",
"5485","Adhikarana_006","notes","This adhikarana establishes that the innermost reality is Brahman itself, not merely a covering. The five sheaths (koshas) culminate in Brahman as their substratum.",
"5486","Adhikarana_006","references","Taittiriya Upanishad 2.1-5, Anandavalli section",
"5487","Adhikarana_007","topic","अन्तःस्थित - The indweller in the earth and other elements mentioned in Brihadaranyaka Upanishad refers to Brahman",
"5488","Adhikarana_007","samshaya","Does 'the one who dwells within the earth' (antahpravishta) refer to the individual soul (jiva), a presiding deity, or Brahman?",
"5489","Adhikarana_007","purvapaksha","The indweller refers to the individual soul or the presiding deities of elements, not Brahman.",
"5490","Adhikarana_007","siddhanta","The indweller is Brahman alone. The characteristics mentioned—ruling from within, being immortal, being different from what it controls—apply only to Brahman as the inner controller (antaryamin) of all beings and elements. This establishes the doctrine of antaryamin.",
"5491","Adhikarana_007","notes","This adhikarana establishes the famous antaryamin doctrine - Brahman as the inner controller dwelling within all entities while remaining distinct from them. It is based on the Antaryamin Brahmana of Brihadaranyaka Upanishad 3.7.",
"5492","Adhikarana_007","references","Brihadaranyaka Upanishad 3.7.3-23 (Antaryamin Brahmana)",
"5493","Adhikarana_008","topic","आकाश - Whether the Akasha (space) mentioned in Chandogya Upanishad refers to the physical element or Brahman",
"5494","Adhikarana_008","samshaya","Does 'akasha' in the passage 'all beings arise from akasha' refer to the physical element ether or to Brahman?",
"5495","Adhikarana_008","purvapaksha","Akasha refers to the physical element ether, one of the five elements (panchamahabhuta).",
"5496","Adhikarana_008","siddhanta","Akasha here refers to Brahman, not the element. The context describes akasha as that from which all beings originate and into which they dissolve, as the basis of bliss—characteristics applicable only to Brahman. The word 'akasha' means 'that which pervades' and can denote Brahman.",
"5497","Adhikarana_008","notes","This adhikarana demonstrates the interpretive principle that words can have different meanings based on context. Here 'akasha' is used as a name for Brahman based on the characteristic of all-pervasiveness.",
"5498","Adhikarana_008","references","Chandogya Upanishad 1.9.1, 8.1.1-5",
"5499","Adhikarana_009","topic","प्राण - Whether Prana mentioned in Chandogya Upanishad as 'greater than' refers to vital air or Brahman",
"5500","Adhikarana_009","samshaya","In the Chandogya passage where various faculties debate supremacy and Prana is declared greater, does Prana refer to the vital breath or to Brahman?",
"5501","Adhikarana_009","purvapaksha","Prana refers to the physiological vital air (mukhya prana), the chief function among bodily functions.",
"5502","Adhikarana_009","siddhanta","Prana here refers to Brahman. The characteristics mentioned—superiority over all organs, the organs approaching 'Prana' for determination, being the eldest and greatest—can apply only to Brahman as the supreme reality, not to the mere vital breath.",
"5503","Adhikarana_009","notes","This adhikarana shows how the word 'prana' can refer to Brahman when the context indicates supreme qualities. The superiority and creative power described transcend the physiological function.",
"5504","Adhikarana_009","references","Chandogya Upanishad 5.1.1-15, Brihadaranyaka Upanishad 6.1.1-14",
"5505","Adhikarana_010","topic","ज्योतिस् - Whether the 'Light' beyond heaven mentioned in Chandogya Upanishad refers to Brahman or physical light",
"5506","Adhikarana_010","samshaya","Does the 'Light that shines beyond heaven, beyond everything, in the highest worlds' refer to the physical sun or to Brahman?",
"5507","Adhikarana_010","purvapaksha","The light refers to the physical sun or celestial luminaries which provide light to the worlds.",
"5508","Adhikarana_010","siddhanta","The light refers to Brahman. The passage describes this light as being 'beyond all,' 'in the highest worlds beyond which there is nothing,' and identical with the light within the person—all characteristics pointing to Brahman as the self-luminous reality, not to physical light which is limited and material.",
"5509","Adhikarana_010","notes","This adhikarana establishes Brahman as the ultimate light (jyotis svarupam), the self-luminous consciousness that illuminates all else. The physical light is dependent, but Brahman is the independent source of all manifestation.",
"5510","Adhikarana_010","references","Chandogya Upanishad 3.13.7-8",
"5511","Adhikarana_011","topic","गायत्री - Whether Gayatri mentioned in Chandogya Upanishad as having four feet refers to the mantra or to Brahman",
"5512","Adhikarana_011","samshaya","In the Chandogya passage describing Gayatri with four feet and six-fold nature, does it refer to the Gayatri meter/mantra or to Brahman?",
"5513","Adhikarana_011","purvapaksha","Gayatri refers to the sacred Vedic meter or the Gayatri mantra used in ritual worship.",
"5514","Adhikarana_011","siddhanta","Gayatri here is a designation for Brahman. The description of Gayatri as the support of all beings, as all this universe, and the identification with the Supreme—these indicate Brahman. The four feet represent the manifestations of Brahman described in the Upanishad. Gayatri is etymologically interpreted as 'that which protects (trayate) those who sing (gayantam),' applicable to Brahman.",
"5515","Adhikarana_011","notes","This shows how even the name of a sacred meter can be used to denote Brahman when the context and attributes described transcend the literal meaning. The four feet of Gayatri are interpreted as cosmic manifestations.",
"5516","Adhikarana_011","references","Chandogya Upanishad 3.12.1-6",
"5517","Adhikarana_012","topic","पादान्त्यप्राण - The Prana mentioned in the context of light at the end of the pada (quarter) of Chandogya Upanishad",
"5518","Adhikarana_012","samshaya","In the Chandogya passage about the person in the sun and the person in the eye, both being connected with prana and light, does this refer to Brahman or to limited entities?",
"5519","Adhikarana_012","purvapaksha","The passages refer to the presiding deities of the sun and the eye, or to limited manifestations, not to Brahman.",
"5520","Adhikarana_012","siddhanta","These passages refer to Brahman alone. The person in the sun (Aditya) and the person in the right eye are both Brahman, described with the attributes of supreme light and life. The unity of both (the person in the sun and in the eye) indicates the non-dual Brahman present everywhere. The characteristics of being the ultimate support and having golden appearance point to Brahman.",
"5521","Adhikarana_012","notes","This adhikarana establishes that Brahman can be meditated upon as present both in the macrocosm (sun) and microcosm (eye). This teaching forms the basis for several Upasanas. It concludes the first pada of the first adhyaya.",
"5522","Adhikarana_012","references","Chandogya Upanishad 1.6.6-8, 1.7.5",
"5523","Adhikarana_013","topic","सर्वगतत्व - Whether Brahman is all-pervading (omnipresent) or has a specific location",
"5524","Adhikarana_013","samshaya","Is Brahman limited to a particular place (like heaven) or is Brahman all-pervading?",
"5525","Adhikarana_013","purvapaksha","Brahman resides only in a specific location (heaven/Vaikuntha) and is not omnipresent. References to Brahman in specific places indicate limited presence.",
"5526","Adhikarana_013","siddhanta","According to Dvaita: Lord Vishnu (Brahman) is all-pervading (sarvagata) as the inner controller (antaryamin) of all beings and things. Though Vishnu's transcendent form resides in Vaikuntha, His immanent presence pervades the entire universe as the indwelling controller. Vishnu is simultaneously transcendent (in Vaikuntha) and immanent (in all beings). This establishes His omnipresence through the antaryamin doctrine.",
"5527","Adhikarana_013","notes","Dvaita interpretation: This adhikarana establishes Vishnu's omnipresence through the doctrine of antaryamin (inner controller). Vishnu pervades all as the controller while remaining eternally distinct from the controlled. His presence is not identity but controlling presence. Refutes the view that God is limited to one location.",
"5528","Adhikarana_013","references","Brihadaranyaka Upanishad 3.7 (Antaryamin Brahmana), Chandogya Upanishad 6.8.7",
"5529","Adhikarana_014","topic","अत्ता - The 'eater' mentioned in Katha Upanishad and whether it refers to the individual soul or Brahman",
"5530","Adhikarana_014","samshaya","In the Katha Upanishad passage about two birds on a tree, does 'atta' (the eater) refer to the individual soul (jiva) or to Brahman?",
"5531","Adhikarana_014","purvapaksha","The 'eater' (atta) refers to the individual soul who experiences the fruits of karma. The two birds represent the jiva in its bound and liberated states.",
"5532","Adhikarana_014","siddhanta","According to Dvaita: The passage describes two eternally distinct entities - the individual soul (jiva) as the eater experiencing karma's fruits, and Lord Vishnu (Paramatman) as the non-eater witness. The Supreme Lord, though dwelling in the heart, does not partake of karma-phala. The two are eternally different (bheda), not two states of the same entity.",
"5533","Adhikarana_014","notes","Dvaita interpretation: This adhikarana establishes the eternal duality between jiva and Paramatman. Both reside in the body (tree), but Vishnu remains untouched by karma while the jiva experiences pleasure and pain. This refutes Advaita's view of the two birds as one consciousness in different states.",
"5534","Adhikarana_014","references","Katha Upanishad 1.3.1 - 'dva suparna sayuja sakhaya', Mundaka Upanishad 3.1.1",
"5535","Adhikarana_015","topic","गुहायां प्रविष्टौ - Whether the being residing in the cave of the heart mentioned in Katha Upanishad refers to jiva or Brahman",
"5536","Adhikarana_015","samshaya","Does the passage about 'the two who have entered the cave (of the heart) and drink the fruits of karma' refer to jiva and Brahman, or to two aspects of jiva?",
"5537","Adhikarana_015","purvapaksha","Both are individual souls - one enjoying fruits in the waking state and another in the dream state.",
"5538","Adhikarana_015","siddhanta","According to Dvaita: The two are the individual soul (jiva) and the Supreme Brahman (Paramatman). The jiva drinks (enjoys) the fruits of karma, while Brahman, though present in the heart as witness and controller, does not partake. They are eternally distinct (bheda). The passage establishes both duality and the Lord's presence as antaryamin.",
"5539","Adhikarana_015","notes","This is closely related to Adhikarana 14. The 'cave' (guha) refers to the heart, the seat of consciousness. This meditation establishes awareness of God's presence within.",
"5540","Adhikarana_015","references","Katha Upanishad 1.3.1, Taittiriya Upanishad 2.1.1",
"5541","Adhikarana_016","topic","अन्तर - Whether the 'inner person' of the size of a thumb mentioned in Katha Upanishad is the jiva or Brahman",
"5542","Adhikarana_016","samshaya","Does 'the person of the size of a thumb dwelling in the heart' refer to the limited individual soul or to Brahman?",
"5543","Adhikarana_016","purvapaksha","The person of thumb-size is the jiva, limited in dimension, residing in the heart. The mention of size indicates limitation.",
"5544","Adhikarana_016","notes","This adhikarana teaches an important hermeneutical principle: apparent limitations mentioned in Upanishads regarding Brahman are for meditation purposes only, not literal descriptions. Brahman remains infinite.",
"5545","Adhikarana_016","references","Katha Upanishad 2.1.12-13, Shvetashvatara Upanishad 3.13",
"5546","Adhikarana_017","topic","अन्तर्यामी - The inner ruler mentioned in Brihadaranyaka Upanishad is Brahman",
"5547","Adhikarana_017","samshaya","Is the inner ruler (antaryamin) distinct from Brahman, or is it Brahman itself controlling from within?",
"5548","Adhikarana_017","purvapaksha","The inner ruler could be a subordinate deity or the collective of individual souls.",
"5549","Adhikarana_017","siddhanta","According to Dvaita: The antaryamin is none other than Lord Vishnu (Brahman). He dwells within all beings and elements as the controller, whom none knows but who knows all, whose body all entities are, and who is immortal. This establishes Vishnu's sovereignty through immanent presence. Though within all, He remains transcendent and distinct from the controlled.",
"5550","Adhikarana_017","notes","This reinforces the antaryamin doctrine established in Adhikarana 7. The inner controller is Brahman exercising supreme sovereignty over all creation while remaining distinct from it. This is a fundamental doctrine in Vedanta.",
"5551","Adhikarana_017","references","Brihadaranyaka Upanishad 3.7.1-23 (Antaryamin Brahmana)",
"5552","Adhikarana_018","topic","अदृश्य - Whether the 'unseen but seeing' entity in Brihadaranyaka Upanishad is Brahman or the individual soul",
"5553","Adhikarana_018","samshaya","Does the description of 'the unseen seer, the unheard hearer, the unthought thinker' refer to the individual soul or to Brahman?",
"5554","Adhikarana_018","purvapaksha","This refers to the individual soul (jiva) as the subject of perception and thought.",
"5555","Adhikarana_018","siddhanta","It refers to Brahman alone. Only Brahman is the ultimate seer that cannot itself be seen, the ultimate knower that cannot be known as an object. The passage states 'there is no other seer, hearer, thinker than This'—indicating the absolute nature of Brahman as pure consciousness, transcending all subject-object duality.",
"5556","Adhikarana_018","notes","This adhikarana establishes Brahman as the ultimate witness-consciousness (sakshi), the eternal subject that can never become an object. It is self-luminous awareness itself.",
"5557","Adhikarana_018","references","Brihadaranyaka Upanishad 3.7.23, 3.8.11",
"5558","Adhikarana_019","topic","वैश्वानर - Whether Vaishvanara mentioned in Chandogya Upanishad refers to the digestive fire, the individual soul, or Brahman",
"5559","Adhikarana_019","samshaya","What does 'Vaishvanara' refer to in the Chandogya passage where it is described with cosmic dimensions (heaven as head, sun as eye, etc.)? Is it the physical digestive fire, jiva, or Brahman?",
"5560","Adhikarana_019","siddhanta","Vaishvanara is Brahman. The cosmic dimensions described (heaven as head, sun as eye, quarters as ears, earth as feet) indicate the universal form of Brahman. Though digestion is mentioned, this is merely one function; the primary teaching is about Brahman as the cosmic person (Virat). The worship is of the Supreme, not mere fire.",
"5561","Adhikarana_019","notes","This is one of the most important adhikaranas, establishing the Vaishvanara Vidya - meditation on the cosmic form of Brahman. It teaches that Brahman pervades and transcends the entire cosmos.",
"5562","Adhikarana_019","references","Chandogya Upanishad 5.11-24",
"5563","Adhikarana_020","topic","द्यावापृथिवी - Whether the being extending from earth to heaven in Chandogya Upanishad is Brahman or something else",
"5564","Adhikarana_020","samshaya","Does 'that which extends from earth to heaven' (dyubhva) mentioned in Chandogya refer to the physical space, cosmic prana, or Brahman?",
"5565","Adhikarana_020","purvapaksha","It refers to the physical space (akasha) between heaven and earth, or to the cosmic vital energy (samashti prana).",
"5566","Adhikarana_020","siddhanta","It refers to Brahman. The passage describes this entity as measured by 'santam' (peace/Brahman) and connects it with qualities like truth, bliss, and infinitude—all characteristics of Brahman alone. The spatial description is metaphorical for Brahman's all-pervasiveness.",
"5567","Adhikarana_020","notes","This adhikarana begins the third pada of the first adhyaya, which focuses on various Brahma-vidyas (meditations on Brahman) taught in different Upanishadic passages. It establishes another meditation on Brahman's cosmic nature.",
"5568","Adhikarana_020","references","Chandogya Upanishad 3.12.7-9",
"5569","Adhikarana_021","topic","भूमा - Whether Bhuma (the Infinite) mentioned in Chandogya Upanishad is Brahman or something limited",
"5570","Adhikarana_021","samshaya","Does 'Bhuma' (the Infinite, the Great) taught to Narada by Sanatkumara refer to Brahman or to some limited greatness like prana or mind?",
"5571","Adhikarana_021","purvapaksha","Bhuma refers to prana or the mind in its expanded state, not to Brahman.",
"5572","Adhikarana_021","siddhanta","Bhuma is Brahman alone. The description establishes: 'Where one sees nothing else, hears nothing else, knows nothing else - that is Bhuma (Infinite). Where one sees something else - that is alpa (finite).' Bhuma is self-established (pratishthita), beyond relativity, and is described as Truth, Bliss, and Infinite—all marks of Brahman.",
"5573","Adhikarana_021","notes","The famous Bhuma Vidya taught to Narada shows the progression from finite objects to the Infinite Brahman. This teaching establishes that true fulfillment lies only in the Infinite, not in anything finite.",
"5574","Adhikarana_021","references","Chandogya Upanishad 7.23-25",
"5575","Adhikarana_022","topic","अक्षर - Whether Akshara (the Imperishable) in Brihadaranyaka Upanishad is Brahman or Pradhana",
"5576","Adhikarana_022","samshaya","Does 'Akshara' (the Imperishable) under whose command sun and moon stand refer to Brahman or to the inert Pradhana of Sankhya?",
"5577","Adhikarana_022","purvapaksha","Akshara is Pradhana (primordial matter), which is imperishable and the material cause of the universe.",
"5578","Adhikarana_022","siddhanta","Akshara is Brahman. The passage says 'at the command (shasana) of that Akshara, sun and moon stand apart.' Only conscious Brahman can command; inert Pradhana cannot. Further, Akshara is described as the seer of the unseen, the knower, the ruler—all indicating conscious Brahman, not unconscious matter.",
"5579","Adhikarana_022","notes","This refutes the Sankhya doctrine that inert Pradhana is the ultimate cause. The Upanishad clearly establishes that only conscious Brahman can be the ultimate ruler and cause of the orderly cosmos.",
"5580","Adhikarana_022","references","Brihadaranyaka Upanishad 3.8.9-11",
"5581","Adhikarana_023","topic","सत् - The Sat (Pure Being/Existence) mentioned in Chandogya Upanishad is Brahman",
"5582","Adhikarana_023","samshaya","Is 'Sat' (Being) that existed in the beginning, before creation, Brahman or Pradhana?",
"5583","Adhikarana_023","purvapaksha","Sat is Pradhana, the material cause from which the universe evolved.",
"5584","Adhikarana_023","siddhanta","Sat is Brahman. The Chandogya passage states 'In the beginning, there was Sat alone, one without a second.' It then describes Sat as thinking 'May I become many' and creating. This deliberation (ikshana) indicates consciousness, which Pradhana lacks. Sat is further described as Reality, Consciousness—characteristics of Brahman alone.",
"5585","Adhikarana_023","notes","This is the famous 'Sad Vidya' of Chandogya Upanishad, establishing Brahman as the sole reality before creation. The teaching 'Tat Tvam Asi' (That Thou Art) culminates this instruction.",
"5586","Adhikarana_023","references","Chandogya Upanishad 6.2.1-3",
"5587","Adhikarana_024","topic","दहर आकाश - Whether the small space (dahara akasha) in the heart-lotus mentioned in Chandogya Upanishad is Brahman or the physical space",
"5588","Adhikarana_024","samshaya","Does 'the small space within the heart-lotus' refer to the physical cavity/space or to Brahman?",
"5589","Adhikarana_024","purvapaksha","Dahara (small) akasha refers to the physical space within the heart, or to the individual soul dwelling there.",
"5590","Adhikarana_024","siddhanta","It refers to Brahman. Though called 'small,' the passage states that within this space is 'all this universe, heaven and earth, fire and air, sun and moon.' It is described as containing all desires, as imperishable, and as the Self to be sought. These descriptions apply only to Brahman. The 'smallness' refers to the meditation location, not to Brahman's nature.",
