id,adhikarana_id,field_type,content,language
"6372","Adhikarana_156","samshaya","Must one master all Upanishads and Vedanta for liberation, or is partial knowledge sufficient?",
"6373","Adhikarana_156","purvapaksha","Complete mastery of all Vedic texts required—partial knowledge insufficient for moksha.",
"6374","Adhikarana_156","siddhanta","According to Dvaita: Madhva teaches that essential knowledge of Vishnu's supremacy with genuine bhakti suffices, though comprehensive study beneficial. His teaching: (1) Core requirements: Understanding Vishnu-sarvottamatva (Vishnu's absolute supremacy), pancha-bheda (five eternal distinctions), jiva-paratantrata (complete dependence), necessity of bhakti, (2) Comprehensive study desirable: Richer understanding strengthens conviction, provides nuanced knowledge, enriches meditation, (3) But not absolute prerequisite: Sincere devotee with basic correct understanding and strong bhakti can attain moksha—Vishnu's grace responds to devotion, not merely scholarship, (4) Guru's role: Teacher ensures disciple grasps essentials even if not everything—quality over mere quantity, (5) Different capacities: Intellectuals may study extensively; simple devotees may know essentials deeply—both paths valid within Dvaita, (6) Wrong knowledge more dangerous than limited knowledge: Better partial correct understanding than comprehensive wrong views (like Advaita's identity doctrine). Essential teaching: Vishnu alone supreme, jivas eternally distinct and dependent, bhakti necessary—grasp this firmly with devotion; liberation assured.",
"6375","Adhikarana_156","notes","Dvaita's pastoral balance: Maintains high intellectual standards (comprehensive study valued) while not excluding sincere simple devotees. Right understanding of key doctrines with devotion more important than encyclopedic but prideful scholarship.",
"6376","Adhikarana_156","references","Mundaka Upanishad 1.2.12 (superior vs. inferior knowledge), Bhagavad Gita 7.3, 9.30-32, 18.66",
"6377","Adhikarana_157","topic","व्यतिहार - Exchange/alternation in meditation—combining or alternating different vidyas",
"6378","Adhikarana_157","samshaya","Should different Upanishadic vidyas (meditation techniques) be practiced in alternation or combined simultaneously?",
"6379","Adhikarana_157","purvapaksha","Each vidya complete in itself—mixing them creates confusion. Practice one vidya exclusively throughout life.",
"6380","Adhikarana_157","siddhanta","According to Dvaita: Madhva teaches flexible approach: similar vidyas can be combined; different vidyas can be alternated; all ultimately focus on Vishnu. His teaching: (1) Common object principle: All authentic vidyas meditate on Vishnu—differences are in attributes emphasized or methods employed, not in ultimate object, (2) Combination appropriate when: Vidyas describe complementary Vishnu-attributes (sovereignty + compassion), different aspects (immanence + transcendence), mutually enriching perspectives, (3) Alternation suitable when: Vidyas require different mental states (active contemplation vs. silent absorption), different times suit different practices (morning vigor vs. evening quietude), (4) Progressive approach: Beginners may focus on one vidya; advanced practitioners integrate multiple; perfected state maintains constant Vishnu-awareness regardless of specific technique, (5) Practical wisdom: Let temperament, life-stage, circumstances guide—what deepens devotion and understanding is appropriate, (6) Unity beneath diversity: Whether Dahara Vidya, Sandilya Vidya, Panchagni Vidya—all lead to Vishnu; methods differ, destination identical. Teacher guides student to suitable combination/alternation matching individual needs.",
"6381","Adhikarana_157","notes","Dvaita's methodological flexibility: While doctrinally strict (bheda-vada non-negotiable), Madhva allows practical flexibility in meditation techniques. This prevents rigid sectarianism while maintaining philosophical precision.",
"6382","Adhikarana_157","references","Chandogya Upanishad (multiple vidyas), Brihadaranyaka Upanishad (various approaches), Bhagavad Gita 12.8-12 (alternative paths)",
"6383","Adhikarana_158","topic","सत्यादि - Satya (truth/reality) and other essential attributes as meditation objects",
"6384","Adhikarana_158","samshaya","When meditating on Brahman as Satya, Jnana, Ananta—are these abstract qualities or personal divine attributes?",
"6385","Adhikarana_158","purvapaksha","These are philosophical abstractions pointing to quality-less (nirguna) Brahman beyond all descriptions.",
"6386","Adhikarana_158","siddhanta","According to Dvaita: Madhva teaches these are Vishnu's real, personal, essential attributes (svarupa-lakshana) to be meditated upon devotionally. His teaching: (1) Satya (Truth/Reality): Vishnu is ultimate reality—eternally existent (nitya), unchanging in essence (avikriya), supremely real (paramarthika); jivas and matter possess derivative reality dependent on Him, (2) Jnana (Knowledge): Vishnu is omniscient consciousness (sarvajna)—knows all past, present, future; all possibilities; every thought in every mind; meditation: seeking His enlightening grace, (3) Ananta (Infinity): Vishnu possesses infinite power (shakti), infinite qualities (guna), infinite forms (rupa), infinite activities (lila)—inexhaustible object of eternal contemplation, (4) These attributes personal not abstract: Belong to Supreme Person (Para Purusha), not impersonal principle—Vishnu HAS infinite knowledge, IS not mere knowledge, (5) Meditation method: Contemplate each attribute → Marvel at its perfection → Contrast with own limitation → Surrender in devotion → Request grace to realize these attributes, (6) Integration: Satya-jnana-anantam is composite description—Vishnu simultaneously possesses all perfections. Dvaita's principle: All Brahman-attributes are real divine perfections, not teaching devices for attributeless void.",
"6387","Adhikarana_158","notes","Dvaita's attribute-realism: Complete rejection of nirguna Brahman. Every Upanishadic description reveals actual Vishnu-quality. This makes meditation concrete, rich, and devotional—contemplating real divine perfections, not dissolving into formless void.",
"6388","Adhikarana_158","references","Taittiriya Upanishad 2.1 (Satyam jnanam anantam Brahma), Mundaka Upanishad 1.1.6, Bhagavad Gita 10.12-13",
"6389","Adhikarana_159","topic","काम - Desires (kama)—whether worldly desires compatible with spiritual meditation or must be renounced",
"6390","Adhikarana_159","samshaya","Can one meditate on Brahman while still harboring worldly desires, or is complete renunciation (sarvakama-tyaga) prerequisite?",
"6391","Adhikarana_159","purvapaksha","Total renunciation essential—even subtle material desires prevent moksha. Only absolute desirelessness permits liberation.",
"6392","Adhikarana_159","siddhanta","According to Dvaita: Madhva teaches progressive transformation of desires: from selfish to devotional, from material to spiritual—complete instant renunciation unnecessary. His teaching: (1) Desire-types: Kama (selfish sensual), artha (legitimate worldly needs), dharma (righteous duties), moksha (liberation)—progressive purification, not instant elimination, (2) Legitimate desires acceptable: Family welfare, honest livelihood, righteous duties—these compatible with spiritual life when performed as Vishnu-seva, (3) Transform, don't merely suppress: Channel desire-energy toward Vishnu—desire His darshan, His grace, His service; passionate devotion (bhakti-rasa) is supreme desire, (4) Detachment from results (nishkama-karma): Continue duties but renounce selfish claim to fruits—offer all to Vishnu, accept what He gives, (5) Gradual refinement: Lower desires naturally fade as higher devotional joy increases—forced renunciation creates tension; organic transformation sustainable, (6) Vishnu-desire infinite: Even muktas eternally desire more of Vishnu—this spiritual longing never ceases, perpetually satisfied yet perpetually seeking. The teaching: Renounce selfishness, not all activity; renounce possessiveness, not proper responsibilities; cultivate supreme desire for Vishnu.",
"6393","Adhikarana_159","notes","Dvaita's positive spirituality: Doesn't demand superhuman instant renunciation. Validates householder path (grihastha-dharma) with spiritual integration. Makes path accessible while maintaining high ultimate standard. Devotional desire for Vishnu spiritually transformative.",
"6394","Adhikarana_159","references","Brihadaranyaka Upanishad 4.4.6, Bhagavad Gita 3.19, 5.12, 9.27-28, 12.6-8, 18.66",
"6395","Adhikarana_160","topic","निर्धारण - Determination (nirdharana) of correct meditation object among similar descriptions",
"6396","Adhikarana_160","samshaya","When different texts describe similar meditations with slight variations, how to determine the correct object and method?",
"6397","Adhikarana_160","purvapaksha","Each variation indicates different meditation—practice all separately to cover all bases.",
"6398","Adhikarana_160","siddhanta","According to Dvaita: Madhva teaches interpretive principles (nyaya) to determine when variations describe one meditation vs. multiple distinct ones. His teaching: (1) Identity of object: If underlying object is same Vishnu, variations describe aspects of single reality—harmonize them, (2) Compatibility test: If descriptions mutually compatible, combine; if contradictory, determine context (time/place/adhikari) for each, (3) Purpose examination: If purpose is same (moksha), likely same ultimate meditation with different pedagogical approaches, (4) Scriptural weight: Shruti over smriti; clearer statement interprets ambiguous ones; Vishnu-focused interpretation preferred when options exist, (5) Guru's guidance essential: Traditional commentaries (Madhva's bhasyas, later acharyas) provide authoritative determination—not individual speculation, (6) Practical principle: When in doubt, choose interpretation emphasizing Vishnu-sarvottamatva, jiva-paratantrata, bheda-vada—these non-negotiable Dvaita essentials. The hermeneutic: Maximum harmonization consistent with Dvaita's core doctrines—avoid multiplication of contradictory practices.",
"6399","Adhikarana_160","notes","Dvaita's interpretive sophistication: Madhva developed detailed hermeneutical principles. This allows systematic interpretation of vast, diverse Upanishadic literature into coherent whole. Prevents both chaos (every text different meaning) and reductionism (all texts say same thing).",
"6400","Adhikarana_160","references","Brahma Sutra 1.1.4 (samanvaya—harmonization), Madhva's Anuvyakhyana (hermeneutical principles)",
"6401","Adhikarana_161","topic","प्रदान - Offering (pradana) to Brahman—worship, seva, and surrender as meditation components",
"6402","Adhikarana_161","samshaya","Is meditation purely mental contemplation, or should it include external worship and service offerings?",
"6403","Adhikarana_161","purvapaksha","True meditation is internal—external worship is for beginners; advanced practitioners transcend ritual.",
"6404","Adhikarana_161","siddhanta","According to Dvaita: Madhva teaches that external worship (archana), service (seva), and offerings (naivedya) complement and strengthen internal meditation throughout spiritual life. His teaching: (1) Integrated practice: Internal meditation (manasa-puja) + external worship (bahya-puja) together most effective—mind and body both engaged in devotion, (2) Deity worship validated: Vishnu truly present in properly consecrated deity (arca-vigraha)—worshiping deity IS worshiping Vishnu, not mere symbolism, (3) Offering significance: Food, flowers, incense offered with devotion become vehicles of love—'gift-giving' strengthens emotional bond with Vishnu, (4) Service attitude: Even mundane duties (cooking, cleaning temple, singing) become spiritual when offered as Vishnu-seva—sanctifies daily life, (5) No graduation beyond worship: Even liberated souls in Vaikuntha engage in Vishnu-seva—worship and service are eternal spiritual nature, not temporary practices, (6) Gita's teaching: 'Whatever you do, eat, offer, give, practice—do as offering to Me'—comprehensive integration of life into devotion. Dvaita rejects dichotomy between 'external ritual' and 'internal meditation'—properly performed, both express and deepen devotion.",
"6405","Adhikarana_161","notes","Dvaita's ritual validation: Makes Dvaita intensely devotional tradition with strong temple culture. Philosophical theism supports practical religion. This differs from Advaita's tendency toward ritual transcendence. Makes Dvaita more accessible to devotional temperaments.",
"6406","Adhikarana_161","references","Bhagavad Gita 9.26-27, 12.20, Vishnu Purana, Pancharatra Agamas (temple worship protocols)",
"6407","Adhikarana_162","topic","गुरुप्रसाद - Guru's grace (guru-prasada) as essential for correct understanding and spiritual progress",
"6408","Adhikarana_162","samshaya","Can one attain Brahma-jnana through independent study, or is guru absolutely necessary?",
"6409","Adhikarana_162","purvapaksha","In modern age with books, commentaries, translations—sincere intelligent person can learn independently without guru.",
"6410","Adhikarana_162","siddhanta","According to Dvaita: Madhva emphatically teaches that authentic guru in legitimate sampradaya (Brahma-Madhva-Gaudiya lineage) is absolutely essential. His teaching: (1) Scripture requires: 'Approach guru with humility, service, questions—wise guru will teach you knowledge' (Gita 4.34), 'This knowledge not revealed except through guru' (Mundaka), (2) Complexity necessitates: Upanishads use cryptic language, apparent contradictions, symbolic expressions—without guru's guidance, misinterpretation certain, (3) Sampradaya preservation: Correct interpretation transmitted through unbroken lineage from Madhva—ensures doctrinal purity and authenticity, (4) Grace-transmission: Guru doesn't merely inform but transmits spiritual power (shakti-pata) through initiation (diksha)—enables realization beyond intellectual understanding, (5) Guru's qualifications: Established in Vishnu-bhakti, learned in shastras, in authentic Madhva lineage, exemplifies teachings in life—not anyone can be guru, (6) Surrender essential: Approaching guru with ego ('I'll evaluate teachings') obstructs; humble receptivity ('Please enlighten me') opens grace-flow. In Dvaita, guru represents Vishnu's teaching presence—dishonoring or bypassing guru is dishonoring Vishnu.",
"6411","Adhikarana_162","notes","Dvaita's traditional authority structure: Strong guru-centricity prevents individualistic interpretations but risks authoritarianism. Madhva tradition emphasizes guru-parampara (disciplic succession). This maintains doctrinal consistency across centuries but makes entry dependent on finding authentic guru.",
"6412","Adhikarana_162","references","Mundaka Upanishad 1.2.12, Bhagavad Gita 4.34, Taittiriya Upanishad 1.11 (guru reverence), Katha Upanishad 1.2.8-9",
"6413","Adhikarana_163","topic","पूर्वविकल्प - Options (vikalpa) in meditation—whether one must choose single method or can practice multiple",
"6414","Adhikarana_163","samshaya","When scriptures present multiple meditation methods, should practitioner exclusively follow one or integrate several?",
"6415","Adhikarana_163","purvapaksha","Mixing methods creates confusion and dilutes practice—commit exclusively to one vidya for life.",
"6416","Adhikarana_163","siddhanta","According to Dvaita: Madhva teaches flexibility based on maturity and circumstances—beginners focus on one method; advanced integrate multiple; all converge on Vishnu. His teaching: (1) Common goal: All authentic vidyas aim at Vishnu-realization—methods vary, destination identical, (2) Beginner strategy: Choose one vidya matching temperament (jnana-oriented, bhakti-oriented, karma-oriented), practice consistently until established, (3) Advanced integration: As practice matures, naturally incorporate complementary elements—jnana with bhakti, meditation with service, study with worship, (4) Life-stage consideration: Student emphasizes study and discipline; householder balances duties with practice; retired/renunciate may intensify meditation, (5) Guru's guidance: Teacher assesses student's nature (adhikara), recommends suitable starting practice, guides progressive incorporation of other elements, (6) Ultimate unity: Perfect practitioner sees all activities as Vishnu-seva—studying, meditating, working, worshiping all expressions of single devotional life. The principle: External diversity of methods, internal unity of Vishnu-focus—flexibility in practice, firmness in doctrine.",
"6417","Adhikarana_163","notes","Dvaita's practical wisdom: Balances structure (definite starting point) with flexibility (progressive integration). Prevents both scattered dilettantism and rigid sectarianism. Recognizes individual differences while maintaining common Vishnu-centered goal.",
"6418","Adhikarana_163","references","Bhagavad Gita 3.3 (two paths for different types), 12.8-12 (hierarchy of practices), 18.45-46 (worship through own duty)",
"6419","Adhikarana_164","topic","विद्या - Knowledge (vidya) types—distinguishing liberating Vishnu-knowledge from worldly learning",
"6420","Adhikarana_164","samshaya","What constitutes para-vidya (supreme knowledge) versus apara-vidya (lower knowledge)?",
"6421","Adhikarana_164","purvapaksha","All knowledge equally valuable—secular sciences contribute to moksha by cultivating intelligence and discipline.",
"6422","Adhikarana_164","siddhanta","According to Dvaita: Madhva teaches clear hierarchy: Para-vidya (Vishnu-knowledge) alone liberates; apara-vidya useful but insufficient. His teaching: (1) Para-vidya definition: Knowledge of Vishnu's supremacy (sarvottamatva), jiva's complete dependence (paratantrata), eternal distinction (bheda), necessity of bhakti—this alone grants moksha, (2) Apara-vidya: Vedic rituals, logic (nyaya), grammar (vyakarana), astronomy (jyotisha), even yogic powers—these purify mind, create conducive conditions, but don't directly liberate, (3) Integration: Apara-vidya serves para-vidya—logic helps defend Dvaita, Sanskrit enables Upanishad study, ethics purifies for meditation—supportive, not substitute, (4) Danger of confusion: Mistaking ritual expertise, philosophical erudition, or yogic powers for para-vidya delays liberation—knowledge ABOUT Vishnu differs from loving knowledge OF Vishnu, (5) Heart-transformation criterion: Para-vidya produces humility, devotion, surrender, detachment from selfishness—intellectual knowledge without character-change is still apara-vidya, (6) Mundaka's teaching: 'Two vidyas to be known—para and apara; of these, para alone liberates'—clear hierarchy. The discrimination: Respect apara-vidya's value, but passionately seek para-vidya as life's supreme goal.",
"6423","Adhikarana_164","notes","Dvaita's focused soteriology: Prevents diffusion of spiritual energy into impressive but non-liberating pursuits. Scholarly Dvaitins master logic, Sanskrit, ritual—but always subordinate to devotional Vishnu-knowledge. This creates both intellectual rigor and devotional depth.",
"6424","Adhikarana_164","references","Mundaka Upanishad 1.1.4-5 (para vs. apara vidya), Bhagavad Gita 7.2-3, 9.1-2 (raja-vidya), Katha Upanishad 2.23",
"6425","Adhikarana_165","topic","अबाध - Non-sublation (abadha)—Vishnu-knowledge's permanent validity unlike worldly knowledge",
"6426","Adhikarana_165","samshaya","Is Brahma-jnana subject to later correction (badha) like other knowledge, or is it absolutely final (abadha)?",
"6427","Adhikarana_165","purvapaksha","All knowledge potentially corrigible—even spiritual understanding may be refined or corrected by deeper realization.",
"6428","Adhikarana_165","siddhanta","According to Dvaita: Madhva teaches that correct Vishnu-knowledge (samyag-jnana) is absolutely final, unsublatable (abadha) reality—never corrected, only deepened. His teaching: (1) Worldly knowledge corrigible: 'I see water'—later corrected to 'mirage'; 'I know him'—later revised by new information; empirical knowledge always provisional, (2) Vishnu-knowledge final: 'Vishnu is supreme'—this never corrected; 'I am eternally dependent on Vishnu'—this never sublated; core truths absolute, (3) Advaita's contradiction: They claim 'Aham Brahmasmi' (I am Brahman) is ultimate, but their own method (neti neti) sublates all prior knowledge—thus even identity-claim should be sublated, (4) Dvaita's consistency: Bheda (distinction) asserted at beginning, maintained throughout, affirmed in liberation—no sublation, no levels of truth, no provisional teaching later discarded, (5) Deepening not correction: Practice increases experiential certainty, devotional intensity, understanding nuances—but foundational truths (Vishnu-supremacy, jiva-dependence, eternal bheda) never change, (6) Liberation's permanence: Once Vaikuntha attained, never lost—based on unchangeable reality (Vishnu's nature, jiva's eternal svarupa). This gives Dvaita tremendous stability—no fear that today's ultimate truth becomes tomorrow's provisional teaching.",
"6429","Adhikarana_165","notes","Dvaita's epistemological confidence: Madhva claims absolute certainty for core doctrines. This prevents endless skepticism and provides firm foundation. Critics see dogmatism; adherents see blessed assurance. Differs from Advaita's claim that even duality-teaching sublated in final realization.",
"6430","Adhikarana_165","references","Taittiriya Upanishad 2.9 (non-fear of knower), Bhagavad Gita 18.66 (final instruction), Brahma Sutra 4.4.22 (anavritti—non-return)",
"6431","Adhikarana_166","topic","अनुबन्ध - Connection (anubandha) between meditation and liberation—meditation's fruits",
"6432","Adhikarana_166","samshaya","What is the relationship between meditation practice and liberation? Is moksha automatic result of meditation or dependent on additional factors?",
"6433","Adhikarana_166","purvapaksha","Meditation mechanically produces liberation like fire produces heat—it's automatic consequence of proper practice.",
"6434","Adhikarana_166","siddhanta","According to Dvaita: Madhva teaches that meditation leads to liberation only through Vishnu's grace (prasada). His teaching: (1) Meditation is necessary but not sufficient—it prepares the jiva and attracts Vishnu's grace, but cannot mechanically force liberation, (2) Grace is essential: Even perfect meditation without Vishnu's grace cannot grant moksha—He alone is the liberator (moksha-data), (3) However, grace is not arbitrary—it responds to sincere devotion and sustained practice; Vishnu grants moksha to those who genuinely surrender and practice correctly, (4) The relationship: Sadhana (practice) creates adhikara (qualification) → Qualification attracts prasada (grace) → Grace grants moksha, (5) Human effort and divine grace collaborate: Neither works alone—effort without grace fails, grace without effort is not given, (6) This prevents both complacency ('grace alone, no need for effort') and pride ('I earned liberation through my practice'). The teaching balances effort and grace, establishing realistic soteriological path requiring both human dedication and divine compassion.",
"6435","Adhikarana_166","notes","Dvaita's grace theology: Madhva's position between karma-marga (works alone) and extreme predestinarianism. Effort matters but doesn't mechanically produce results. Grace responds to genuine devotion. This creates humble, dedicated practice without spiritual pride.",
"6436","Adhikarana_166","references","Katha Upanishad 1.2.23, Mundaka Upanishad 3.2.3, Bhagavad Gita 18.56, 18.66",
"6437","Adhikarana_167","topic","प्रज्ञान्तर - Different types of knowledge and whether all lead to liberation or only Brahman-knowledge",
"6438","Adhikarana_167","samshaya","Does knowledge of Vedic rituals, ethics, or any spiritual knowledge lead to moksha, or only para-vidya (supreme Vishnu-knowledge)?",
"6439","Adhikarana_167","purvapaksha","All valid knowledge contributes to liberation—ritual knowledge, ethical wisdom, yogic attainment all accumulate toward moksha.",
"6440","Adhikarana_167","siddhanta","According to Dvaita: Madhva clearly distinguishes para-vidya (liberating knowledge) from apara-vidya (preparatory knowledge). His teaching: (1) Only Vishnu-knowledge liberates: Knowing Vishnu's supremacy (sarvottamatva), complete dependence on Him (paratantrata), eternal distinction (bheda), and surrendering in bhakti—this alone grants moksha, (2) Other knowledge preparatory: Ritual knowledge purifies mind, ethical discipline creates fitness, yogic practices develop concentration—all valuable but insufficient alone, (3) Integration necessary: Apara-vidya serves para-vidya—rituals without devotion are empty; devotion without understanding is incomplete; complete path integrates all properly, (4) Direct vs. indirect: Vishnu-knowledge directly causes liberation; other knowledge indirectly supports by creating qualification, (5) Danger of confusion: Mistaking ritual expertise or philosophical learning for liberating knowledge delays moksha—must distinguish means from goal, (6) Scriptural clarity: Mundaka explicitly differentiates—lower knowledge (rituals, sciences) vs. higher knowledge (Brahman)—only higher liberates. The emphasis: Passionately pursue Vishnu-knowledge while respecting supportive disciplines.",
