id,adhikarana_id,field_type,content,language
"6141","Adhikarana_116","notes","Dvaita integration: Madhva's approach allows drawing from all Vedic sources to build complete understanding of Vishnu while respecting distinct meditation traditions. This balances comprehensiveness with systematic practice under guru guidance.",
"6142","Adhikarana_116","references","Chandogya Upanishad various vidyas, Brihadaranyaka Upanishad, Brahma Sutra 3.3",
"6143","Adhikarana_117","topic","पराभिध्यान - Whether meditation should focus on the Supreme (Para) Vishnu or on qualified aspects",
"6144","Adhikarana_117","samshaya","Should meditation be directed toward Vishnu's supreme transcendent form (Para) or toward His immanent manifestations and qualified attributes?",
"6145","Adhikarana_117","purvapaksha","Meditation on saguna (qualified) Brahman with attributes is sufficient. The attributeless supreme is too abstract for human mind.",
"6146","Adhikarana_117","siddhanta","According to Dvaita: Madhva teaches that meditation should ultimately be on Para Vishnu (the Supreme) while utilizing qualified forms and attributes as aids. His teaching: (1) Para Vishnu—the supreme transcendent form in Vaikuntha—is the ultimate object of meditation, possessing infinite auspicious qualities (ananta kalyana gunas), (2) Meditation progresses through stages: begin with Vishnu's accessible forms (avataras, murti), then His cosmic manifestations, finally His supreme Para form, (3) Attributes and forms are real, not illusions—they reveal Vishnu's actual nature, making Him accessible to devotees at various levels, (4) The meditator should focus on Vishnu's supremacy (sarvottamatva), His complete independence (svatantrata), and His controller-ship of all (sarvantaryamitva), (5) Ultimately, all meditation aims at developing firm devotion (dridha-bhakti) to Para Vishnu leading to His grace. Forms and attributes are stepping stones to intimate relationship with the Supreme Person.",
"6147","Adhikarana_117","notes","Dvaita theism: Madhva rejects formless meditation as inadequate. Vishnu is supremely personal with infinite qualities. Meditation is relational communion with the Supreme Person, not dissolution into attributeless void. This distinguishes Dvaita from Advaita's nirguna meditation.",
"6148","Adhikarana_117","references","Mundaka Upanishad 3.2.3, Bhagavad Gita 12.5, Vishnu Purana",
"6149","Adhikarana_118","topic","देहयोग - Whether meditations requiring bodily postures and conditions are essential or optional",
"6150","Adhikarana_118","samshaya","Are specific bodily postures, locations, and times essential for meditation on Brahman, or is meditation purely mental and independent of physical conditions?",
"6151","Adhikarana_118","purvapaksha","Meditation is purely mental. Physical conditions like posture, place, and time are irrelevant to spiritual practice.",
"6152","Adhikarana_118","siddhanta","According to Dvaita: Madhva teaches that while meditation is primarily mental, appropriate bodily discipline and conditions significantly aid spiritual practice. His teaching: (1) Proper sitting posture (asana) steadies the body, which calms the mind—physical stillness supports mental focus, (2) Sacred places (tirtha, temple, solitude) have spiritual vibrations that facilitate meditation—Vishnu's presence is more manifest in consecrated spaces, (3) Auspicious times (brahma-muhurta, sandhya) when sattvic quality dominates make meditation easier and more fruitful, (4) Ritual purity (saucha), proper diet, and ethical conduct create conducive conditions for devotional practice, (5) However, true bhakti transcends all conditions—the advanced devotee can meditate on Vishnu anywhere, anytime. Physical disciplines are aids for most seekers, not absolute requirements for Vishnu's grace. The embodied state requires acknowledging mind-body connection while striving for mental mastery.",
"6153","Adhikarana_118","notes","Dvaita practical approach: Madhva balances idealism with realism. For most practitioners, physical conditions matter. This validates traditional yoga practices while maintaining that devotion's essence is internal relationship with Vishnu.",
"6154","Adhikarana_118","references","Bhagavad Gita 6.11-14, Chandogya Upanishad 8.1, Yoga Sutras",
"6155","Adhikarana_119","topic","तदभाव - Whether absence of desire and worldly attachments is necessary for meditation",
"6156","Adhikarana_119","samshaya","Is complete renunciation of all desires and worldly engagement required for Brahma-vidya, or can meditation be practiced while fulfilling worldly duties?",
"6157","Adhikarana_119","purvapaksha","Total renunciation (sannyasa) is mandatory. One must abandon all desires, possessions, and relationships to pursue Brahman knowledge.",
"6158","Adhikarana_119","siddhanta","According to Dvaita: Madhva teaches that detachment (vairagya) from selfish desires is essential, but external renunciation is not mandatory for all seekers. His teaching: (1) Internal renunciation—freedom from desire for fruits (nishkama karma)—is necessary; external abandonment is optional and suited only for some, (2) Desires for sensory pleasure (kama), wealth (artha), and ego-gratification must be transcended, but desire for Vishnu (Vishnu-kama) should increase, (3) The householder practicing karma-yoga with Vishnu-arpana bhava can attain moksha—monasticism is one path, not the only path, (4) What must be absent is: attachment to results, sense of doership, and obstacles to devotion. Duties themselves don't bind when performed as worship, (5) The key is transformation of desire—from self-centered to Vishnu-centered—not suppression or elimination. Passionate devotion to Vishnu is the highest state.",
"6159","Adhikarana_119","notes","Dvaita accessibility: Madhva makes liberation accessible to householders by emphasizing internal transformation over external renunciation. Desire directed toward Vishnu is spiritually valuable, not an obstacle. This validates grihastha dharma as a complete spiritual path.",
"6160","Adhikarana_119","references","Bhagavad Gita 3.19, 5.12, 18.6-9, Brihadaranyaka Upanishad 3.5.1",
"6161","Adhikarana_120","topic","प्रभोध - Whether constant remembrance (smarana) of Vishnu is necessary or occasional meditation suffices",
"6162","Adhikarana_120","samshaya","Should the meditator maintain continuous awareness of Brahman throughout daily activities, or is periodic formal meditation sufficient?",
"6163","Adhikarana_120","purvapaksha","Formal meditation sessions at fixed times are sufficient. Constant remembrance is impossible for those engaged in worldly activities.",
"6164","Adhikarana_120","siddhanta","According to Dvaita: Madhva strongly emphasizes continuous remembrance (akhanda-smarana) of Vishnu as the ideal while acknowledging that capacity varies. His teaching: (1) The highest practice is unbroken awareness of Vishnu (satatam kirtayanto mam)—the advanced devotee maintains Vishnu-consciousness throughout all activities, (2) For most seekers, the practice combines: regular formal meditation sessions (morning, evening) with frequent brief remembrance during daily activities, (3) Every action should be performed with awareness that Vishnu is the witness and controller—this transforms routine work into spiritual practice, (4) The goal is to make Vishnu-smarana as natural as breathing—spontaneous, effortless, constant loving remembrance, (5) Even one-pointed meditation (ekagra chitta) for brief periods is valuable if done with devotion—quality and devotion matter more than duration. Progression: from scheduled meditation → frequent remembrance → constant awareness → absorption in Vishnu.",
"6165","Adhikarana_120","notes","Dvaita devotion: Madhva's emphasis on continuous remembrance makes spiritual life integrated with daily activities, not separate from them. This is practical bhakti—transforming consciousness through cultivating Vishnu-awareness in all circumstances.",
"6166","Adhikarana_120","references","Bhagavad Gita 8.14, 9.22, 18.57, Vishnu Sahasranama, Srimad Bhagavatam",
"6167","Adhikarana_121","topic","कर्मानुस्मृति - Whether remembering past karmas is part of meditation practice",
"6168","Adhikarana_121","samshaya","Should the meditator contemplate past karmas and their consequences, or should meditation focus solely on Brahman excluding all other thoughts?",
"6169","Adhikarana_121","purvapaksha","Meditation should be purely positive, focused only on Brahman's nature. Dwelling on past karmas is a distraction.",
"6170","Adhikarana_121","siddhanta","According to Dvaita: Madhva teaches that awareness of one's karmic bondage and Vishnu's role as karma-phala-data (giver of karma results) is valuable for developing proper perspective. His teaching: (1) Understanding karma's operation reveals Vishnu's justice—He dispenses exactly appropriate results, fostering acceptance of life circumstances, (2) Recognizing one's own past mistakes cultivates humility and surrender—awareness of unworthiness makes Vishnu's grace more precious, (3) However, dwelling obsessively on past sins is counterproductive—after acknowledgment and repentance, focus shifts to Vishnu's mercy, (4) The proper attitude: 'I am bound by beginningless karma, unable to free myself; only Vishnu's grace can liberate me'—this understanding motivates devotion, (5) Meditation progresses from: awareness of bondage → recognition of dependence → surrender to Vishnu → absorption in His grace. Past karma is acknowledged to deepen present devotion, not to wallow in guilt.",
"6171","Adhikarana_121","notes","Dvaita psychology: Madhva's approach balances realism about karma with optimism about grace. Awareness of bondage increases appreciation for Vishnu's liberating power. This creates genuine humility without debilitating self-condemnation.",
"6172","Adhikarana_121","references","Bhagavad Gita 4.36-37, 18.66, Vishnu Purana",
"6173","Adhikarana_122","topic","सम्पत्ति - Whether specific qualities (sampatti) like calmness and control are prerequisites or results of meditation",
"6174","Adhikarana_122","samshaya","Are virtues like mental calmness (shama), sense control (dama), and forbearance (titiksha) prerequisites for meditation, or do they naturally arise from meditation practice?",
"6175","Adhikarana_122","purvapaksha","These virtues are natural results of meditation. One can begin practice without perfecting them first.",
"6176","Adhikarana_122","siddhanta","According to Dvaita: Madhva teaches that basic ethical virtues are prerequisites (sadhana-chatustaya), while their perfection comes through practice. His teaching: (1) The fourfold qualification is necessary to begin serious spiritual practice: viveka (discrimination), vairagya (detachment), shamadi-shatka (six virtues), mumukshutva (desire for liberation), (2) The six virtues—shama (calmness), dama (control), uparati (withdrawal), titiksha (forbearance), shraddha (faith), samadhana (concentration)—should be cultivated before intense meditation, (3) However, perfection comes gradually through practice—beginners have basic levels, which deepen through devotion to Vishnu, (4) Ethical living and meditation support each other—virtue facilitates meditation, meditation strengthens virtue in positive feedback, (5) Ultimately, Vishnu's grace grants these qualities fully—sincere effort combined with devotion transforms character. The process: basic qualification → practice → grace → perfection.",
"6177","Adhikarana_122","notes","Dvaita balanced approach: Madhva requires genuine preparation while acknowledging that practice itself transforms practitioners. This prevents both premature practice (unprepared mind) and indefinite postponement (waiting for impossible perfection).",
"6178","Adhikarana_122","references","Vivekachudamani, Bhagavad Gita 13.7-11, Mundaka Upanishad 3.2.3",
"6179","Adhikarana_123","topic","स्थानभेद - Whether the location (sthana) of meditation in the body (heart, head, etc.) affects practice",
"6180","Adhikarana_123","samshaya","Should meditation focus on Brahman in a specific bodily location (heart-lotus, space between eyebrows, crown), or is location irrelevant?",
"6181","Adhikarana_123","purvapaksha","Brahman is all-pervading and formless. Focusing on specific bodily locations is superstition with no spiritual value.",
"6182","Adhikarana_123","siddhanta","According to Dvaita: Madhva teaches that while Vishnu as antaryamin pervades all, focusing on specific locations aids concentration and has scriptural sanction. His teaching: (1) The heart (hridaya-pundarika) is the primary seat for meditation—Vishnu as antaryamin is specially manifest there, and the jiva resides in the heart, (2) Different meditation locations serve different purposes: heart for bhakti-oriented meditation, ajna chakra (between eyebrows) for visualization, sahasrara (crown) for advanced yogic practices, (3) These are aids to concentration (dharana)—the untrained mind needs a focal point; imagining Vishnu in the heart makes meditation concrete, (4) Scriptural vidyas prescribe specific locations—Dahara Vidya focuses on heart-space, establishing validity of this practice, (5) Advanced meditators transcend location dependence—but for most, following traditional guidance aids progress. The location is a support for visualization, not Vishnu's actual limit.",
"6183","Adhikarana_123","notes","Dvaita practical wisdom: Madhva validates traditional meditation techniques while clarifying their purpose. Bodily locations are concentration aids, not Vishnu's actual residence (He pervades all). This combines practical effectiveness with philosophical accuracy.",
"6184","Adhikarana_123","references","Chandogya Upanishad 8.1 (Dahara Vidya), Bhagavad Gita 6.13, Yoga Sutras",
"6185","Adhikarana_124","topic","अरूप - Whether meditation on formless (nirakara) Brahman or form (sakara) is superior",
"6186","Adhikarana_124","samshaya","Should meditation be on Brahman as formless and attributeless (nirguna, nirakara), or on Brahman with form and qualities (saguna, sakara)?",
"6187","Adhikarana_124","purvapaksha","Formless meditation on pure consciousness is superior. Forms are concessions for the intellectually weak.",
"6188","Adhikarana_124","siddhanta","According to Dvaita: Madhva decisively teaches that meditation on Vishnu's personal form with infinite auspicious qualities is the correct and superior method. His teaching: (1) Vishnu is not formless—He possesses a supremely beautiful transcendent form (para-rupa) with infinite qualities. The concept of 'formless Brahman' is a philosophical error, (2) Meditation on qualities (gunas) and forms (rupa) is natural to human consciousness—the mind needs something concrete to grasp. Abstract formlessness leads to mental blankness, not spiritual realization, (3) Vishnu's forms are real eternal truths, not temporary creations—His Vaikuntha form, avatara forms, and deity forms are genuine manifestations, (4) Love and devotion require a personal object—one cannot love or serve an impersonal abstraction. Bhakti necessitates Vishnu's personality, (5) Scriptures abundantly describe Vishnu's forms and qualities—Upanishadic references to 'formless' mean 'not material,' not 'without any form.' Meditation on Vishnu's beautiful form with loving devotion is the highest spiritual practice.",
"6189","Adhikarana_124","notes","Dvaita vs Advaita: This is a fundamental difference. Madhva's personalism affirms Vishnu's eternal form and qualities as ultimate reality, rejecting formless meditation as philosophically incorrect and devotionally sterile. Saguna meditation is not lower practice but the highest truth.",
"6190","Adhikarana_124","references","Shvetashvatara Upanishad 3.8, Bhagavad Gita 12.1-5, Vishnu Purana, Brahma Samhita",
"6191","Adhikarana_125","topic","उपमा - The use of similes and analogies in meditation to understand Brahman's nature",
"6192","Adhikarana_125","samshaya","Are Upanishadic similes (sun, ocean, king, etc.) for Brahman merely teaching aids to be discarded, or should they be incorporated into meditation?",
"6193","Adhikarana_125","purvapaksha","Analogies are provisional teaching tools. Once understanding is gained, they should be abandoned for direct realization.",
"6194","Adhikarana_125","siddhanta","According to Dvaita: Madhva teaches that Upanishadic analogies reveal real aspects of Vishnu's nature and should be meditated upon to deepen understanding. His teaching: (1) When scriptures compare Vishnu to the sun (illuminating all), ocean (source of all), king (ruling all), these reveal genuine attributes—the analogies are not arbitrary but point to real qualities, (2) Meditation on these similes helps comprehend Vishnu's incomprehensible greatness—comparing to known phenomena makes the transcendent accessible to finite minds, (3) However, the meditator must understand the analogy's limitations—Vishnu infinitely exceeds all comparisons. Sun illumines physically; Vishnu illumines consciousness itself, (4) Some analogies emphasize specific aspects: Vishnu as inner controller (antaryamin) is like thread in pearls; as life-giver like prana in body; as witness like sun revealing all, (5) Advanced meditation combines multiple analogies to build comprehensive vision—each reveals one facet of Vishnu's infinite reality. Analogies are not abandoned but transcended while remaining valid pointers.",
"6195","Adhikarana_125","notes","Dvaita hermeneutics: Madhva takes scriptural language seriously. Analogies are revelatory, not merely pedagogical. They disclose real relationships between Vishnu and creation, enriching devotional understanding and meditation practice.",
"6196","Adhikarana_125","references","Brihadaranyaka Upanishad 3.7 (Antaryamin), Chandogya Upanishad various analogies, Bhagavad Gita 15.1-3 (inverted tree)",
"6197","Adhikarana_126","topic","अम्बुवत् - Whether meditation attributes from different vidyas merge like waters mixing",
"6198","Adhikarana_126","samshaya","When combining vidyas about the same Brahman, do their attributes blend seamlessly, or must contradictions be resolved?",
"6199","Adhikarana_126","purvapaksha","Each vidya maintains its distinct characteristics. Mixing attributes from different sources creates confusion.",
"6200","Adhikarana_126","siddhanta","According to Dvaita: Madhva teaches that complementary attributes of Vishnu from different Upanishadic sources merge harmoniously like waters of rivers merging into ocean. His teaching: (1) All authentic Vedic teachings about Vishnu are mutually compatible because they describe the same Supreme Reality from different perspectives, (2) When one Upanishad describes Vishnu as jyoti (light), another as prana (life), another as akasha (all-pervading), these combine to enrich understanding—all are true simultaneously, (3) Apparent contradictions resolve at higher understanding—size references (atomic, cosmic) refer to meditation perspectives, not Vishnu's actual dimension, (4) The principle: non-contradictory attributes accumulate; contradictory descriptions refer to different aspects or contexts, (5) Like rivers retaining individual qualities briefly before blending in ocean, individual vidyas maintain distinctiveness in practice but point to unified Vishnu-knowledge. The meditator harmonizes all teachings into comprehensive vision of Vishnu's infinite nature.",
"6201","Adhikarana_126","notes","Dvaita synthesis: Madhva's integrative approach allows drawing from all Vedic sources to build complete Vishnu-knowledge. This scholarly comprehensiveness distinguishes Dvaita—not sectarian selection but systematic integration of all shruti.",
"6202","Adhikarana_126","references","Chandogya Upanishad 6.10.1-2, Mundaka Upanishad 3.2.8, Bhagavad Gita 15.15",
"6203","Adhikarana_127","topic","वृद्धिह्रास - Whether Brahman undergoes increase (vriddhi) and decrease (hrasa) or remains unchangeable",
"6204","Adhikarana_127","samshaya","Do scriptural references to Brahman's expansion and contraction indicate real change, or is Brahman eternally unchanging?",
"6205","Adhikarana_127","purvapaksha","Brahman is absolutely immutable. Any mention of change refers to Brahman's manifestations, not to Brahman itself.",
"6206","Adhikarana_127","siddhanta","According to Dvaita: Madhva distinguishes between Vishnu's essential nature (svarupa) which is eternally unchanging, and His powers/manifestations (shakti/vibhuti) which exhibit activity. His teaching: (1) Vishnu's essential attributes—sarvottamatva, svatantrata, ananta-kalyana-guna—are absolutely immutable and eternal, (2) Creation, sustenance, and dissolution represent Vishnu's power (shakti) in action, not change in His nature—like sun's light appearing and disappearing doesn't change sun's essence, (3) References to Brahman's expansion (in creation) and contraction (in dissolution) describe cosmic processes under Vishnu's control, not alterations in Vishnu Himself, (4) Vishnu remains transcendent (para) even while immanent (antaryamin) in creation—His presence in universe doesn't diminish His completeness in Vaikuntha, (5) The doctrine: Vishnu is nitya-shuddha-buddha-mukta-svabhava (eternally pure, conscious, free by nature)—no increase or decrease possible to perfection. Activity is through shakti, not change in svarupa.",
"6207","Adhikarana_127","notes","Dvaita theology: Madhva preserves divine immutability while explaining creation. Vishnu creates through power, not transformation of essence. This avoids Advaita's problem (unchanging Brahman cannot create) and Sankhya's problem (unconscious change).",
"6208","Adhikarana_127","references","Brihadaranyaka Upanishad 4.4.18, Bhagavad Gita 9.4-5, Shvetashvatara Upanishad 6.8",
"6209","Adhikarana_128","topic","पालकत्व - Brahman as the protector and sustainer who should be meditated upon as refuge",
"6210","Adhikarana_128","samshaya","Should meditation include awareness of Brahman as personal protector, or is such devotional dependence anthropomorphizing the transcendent?",
"6211","Adhikarana_128","purvapaksha","Brahman is impersonal reality beyond personal relationships. Seeking protection is religious sentiment, not philosophical truth.",
"6212","Adhikarana_128","siddhanta","According to Dvaita: Madhva strongly affirms meditating on Vishnu as the supreme protector (palaka), sustainer (bharta), and refuge (sharana). His teaching: (1) Vishnu actively protects devotees—this is not metaphor but reality. He intervenes in cosmic and individual affairs to safeguard those who surrender, (2) The meditation on Vishnu as protector cultivates surrender (sharanagati) and loving dependence (paratantra-bhava)—recognizing absolute dependence on Vishnu's grace, (3) Stories of Vishnu's protection (Prahlada, Draupadi, Gajendra) demonstrate real divine intervention validating devotional trust, (4) The protective aspect reveals Vishnu's compassion (karuna) and accessibility—He is not distant abstraction but caring Supreme Person responding to devotees' needs, (5) Meditation progresses: recognition of helplessness → calling upon Vishnu → experiencing His protection → deepening trust → complete surrender → grace → liberation. Vishnu as palaka is both meditation object and actual refuge.",
"6213","Adhikarana_128","notes","Dvaita personalism: Madhva's theism makes God-jiva relationship real and reciprocal. Vishnu genuinely cares for and protects devotees. This validates devotional practices of prayer and surrender as spiritually efficacious, not mere psychology.",
"6214","Adhikarana_128","references","Bhagavad Gita 9.31, 18.66, Vishnu Sahasranama, Puranic stories of divine protection",
"6215","Adhikarana_129","topic","अव्यक्त - Whether the Avyakta (Unmanifest) mentioned in Katha Upanishad is Prakriti or Brahman",
"6216","Adhikarana_129","samshaya","Does 'Avyakta' beyond the manifest refer to primordial matter (Prakriti) or to transcendent Brahman?",
"6217","Adhikarana_129","purvapaksha","Avyakta is Prakriti, the unmanifest material cause from which manifest universe emerges, as Sankhya teaches.",
"6218","Adhikarana_129","siddhanta","According to Dvaita: Madhva interprets Katha Upanishad's hierarchy (senses < mind < intellect < mahat < avyakta < purusha) as levels of subtlety leading to Vishnu. His teaching: (1) In the ascending hierarchy, 'avyakta' refers to Prakriti in its unmanifest state, but it is NOT the ultimate—beyond avyakta is Purusha (Vishnu), (2) Prakriti as avyakta is real but completely controlled by Vishnu—it's the subtlest material principle, yet still dependent and inert, (3) Beyond Prakriti stands Vishnu, the conscious Supreme—the passage establishes clear superiority: material → subtle material (Prakriti) → conscious jivas → Supreme Vishnu, (4) Meditation should not stop at any intermediate level but reach Para Purusha (Vishnu)—understanding the hierarchy helps transcend attachments progressively, (5) The teaching: creation has layers, but Vishnu transcends all as both immanent controller and transcendent Lord. This establishes Vishnu-sarvottamatva over both conscious (jiva) and unconscious (Prakriti) categories.",
"6219","Adhikarana_129","notes","Dvaita vs Sankhya: Madhva accepts Prakriti as avyakta but places Vishnu beyond it. This refutes Sankhya's stopping at unconscious Prakriti as ultimate. The Upanishadic hierarchy is not Sankhya's dualism but progressive teaching leading to theistic conclusion.",
"6220","Adhikarana_129","references","Katha Upanishad 1.3.10-11, Bhagavad Gita 8.18-21, Shvetashvatara Upanishad 4.5",
"6221","Adhikarana_130","topic","उभयव्यपदेश - Brahman described with both transcendent and immanent characteristics",
