adhyaya,pada,sutra_number,sutra_text,adhikarana
4,4,16,ॐ स्वाप्यायसम्पत्त्योरन्यतरापेक्षमाविष्कृतं हि ॐ,उभयविधभोगाधिकरणम्
4,4,17,ॐ जगद्व्यापारवर्जम् ॐ,सर्वकामाधिकरणम् (जगद्व्यापाराधिकरणम्)
4,4,18,ॐ प्रकरणादसन्निहितत्वाच्च ॐ,सर्वकामाधिकरणम् (जगद्व्यापाराधिकरणम्)
4,4,19,ॐ प्रत्यक्षोपदेशादिति चेन्नाधिकारिकमण्डलस्थोक्तेः ॐ,सर्वकामाधिकरणम् (जगद्व्यापाराधिकरणम्)
4,4,20,ॐ विकारावर्ति च तथाहि दर्शयति ॐ,सर्वकामाधिकरणम् (जगद्व्यापाराधिकरणम्)
4,4,21,ॐ स्थितिमाह दर्शयतश्चैवं प्रत्यक्षानुमाने ॐ,स्थित्य(एकरूपा)धिकरणम्
4,4,22,ॐ भोगमात्रसाम्यलिङ्गाच्च ॐ,स्थित्य(एकरूपा)धिकरणम्
4,4,23,ॐ अनावृत्तिः शब्दादनावृत्तिः शब्दात् ॐ,अनावृत्यधिकरणम्
