adhyaya,pada,sutra_number,sutra_text,adhikarana
3,3,15,ॐ आध्यानाय प्रयोजनाभावात् ॐ,अध्यानाधिकरणम्
3,3,16,ॐ आत्मशब्दाच्च ॐ,अध्यानाधिकरणम्
3,3,17,ॐ आत्मगृहीतिरितवदुत्तरात् ॐ,आत्मगृहीत्यधिकरणम्
3,3,18,ॐ अन्वयादिति चेत् स्यादवधारणात् ॐ,अन्वयाधिकरणम्
3,3,19,ॐ कार्याख्यानादपूर्वम् ॐ,कार्या(ख्यान)धिकरणम्
3,3,20,ॐ समान एवं चाभेदात् ॐ,समानाधिकरणम्
3,3,21,ॐ सम्बन्धादेवमन्यत्रापि ॐ,नवाधिकरणम्
3,3,22,ॐ न वा विशेषात् ॐ,नवाधिकरणम्
3,3,23,ॐ दर्शयति च ॐ,नवाधिकरणम्
3,3,24,ॐ सम्भृतिद्युव्याप्तपि चातः ॐ,सम्भृत्यधिकरणम्
3,3,25,ॐ पुरुषविद्यायामपि चेतरेषामनाम्नानात् ॐ,पुरुषविद्याधिकरणम्
3,3,26,ॐ वेधाद्यर्थभेदात् ॐ,वेधाद्यधिकरणम्
3,3,27,ॐ हानौ तूपायनशब्दशेषत्वात् कुशाछन्दस्तुत्युपगानवत् तदुक्तम् ॐ,मुक्तोपासनाधिकरणम् (हान्यधिकरणम्)
3,3,28,ॐ साम्परायेतर्तव्याभावात् तथा ह्यन्ये ॐ,मुक्तोपासनाधिकरणम् (हान्यधिकरणम्)
3,3,29,ॐ छन्दत उभयाविरोधात् ॐ,छन्दादिकरणम्
3,3,30,ॐ गतेरर्थवत्त्वमुभयथाऽन्यथा ह विरोधः ॐ,छन्दादिकरणम्
3,3,31,ॐ उपपन्नस्तल्लक्षणार्थोपलब्धेर्लोकवत् ॐ,छन्दादिकरणम्
3,3,32,ॐ अनियमः सर्वेषामविरोधाच्छब्दानुमानाभ्याम् ॐ,अनियमाधिकरणम्
3,3,33,ॐ यावदधिकारमवस्थितिराधिकारिकाणाम् ॐ,यावदधिकाराधिकरणम्
3,3,34,ॐ अक्षरधियां त्वविरोधः सामान्यतद्भावाभ्यामौपसदवत् तदुक्तम् ॐ,यावदधिकाराधिकरणम्
3,3,35,ॐ इयदामननात् ॐ,इयदामननाधिकरणम्
3,3,36,ॐ अन्तरा भूतग्रामवदिति चेत् तदुक्तम् ॐ,इयदामननाधिकरणम्
3,3,37,ॐ अन्यथा भेदानुपपत्तिरिति चेन्नोपदेशवत् ॐ,इयदामननाधिकरणम्
3,3,38,ॐ व्यतिहारो विशिंषन्ति हीतरवत् ॐ,व्यतिहाराधिकरणम्
3,3,29,ॐ सैव हि सत्यादयः ॐ,सत्याद्यधिकरणम्
3,3,40,ॐ कामादितरत्र तत्र चायतनादिभ्यः ॐ,कामाधिकरणम्
3,3,41,ॐ आदरादलोपः ॐ,कामाधिकरणम्
3,3,42,ॐ उपस्थितेस्तद्वचनात् ॐ,कामाधिकरणम्
3,3,43,ॐ तन्निर्धारणार्थनियमस्तद्दृष्टेः पृथग्ध्यप्रतिबन्धः पलम् ॐ,निर्धारणाधिकरणम्
3,3,44,ॐ प्रदानवदेव हि तदुक्तम् ॐ,प्रदानाधिकरणम्
3,3,45,ॐ लिङ्गभूयस्त्वात् तद्धि बलीयस्तदपि ॐ,गुरुप्रसादाधिकरणम् (लिङ्गभूयस्त्वाधिकरणम्)
3,3,46,ॐ पूर्वविकल्पःप्रकरणात् स्यात् क्रियामानसवत् ॐ,पूर्वविकल्पाधिकरणम्
3,3,47,ॐ अतिदेशाच्च ॐ,पूर्वविकल्पाधिकरणम्
3,3,48,ॐ विद्यैव तु निर्धारणात् ॐ,विद्याधिकरणम्
3,3,49,ॐ दर्शनाच्च ॐ,विद्याधिकरणम्
3,3,50,ॐ श्रुत्यादिबलीयास्त्वाच्च न बाधः ॐ,अबाधाधिकरणम् (श्रुत्यधिकरणम्)
3,3,51,ॐ अनुबन्धादिभ्यः ॐ,अनुबन्धाद्यधिकरणम्
3,3,52,ॐ प्रज्ञान्तरपृथक्त्ववद्दृष्टिश्च तदुक्तम् ॐ,दर्शनबेधादिकरणम् (प्रज्ञान्तराधिकरणम्)
3,3,53,ॐ न सामान्यादप्युपलब्धेर्मृत्युवन्न हि लोकापत्तिः ॐ,न सामान्याधिकरणम्
3,3,54,ॐ परेण शब्दस्य ताद्विध्यं भूयस्त्वात् त्वनुबन्धः ॐ,ताद्विध्याधिकरणम् (परेणाधिकरणम्)
3,3,55,ॐ एकः आत्मनः शरीरे भावात् ॐ,एकाधिकरणम्
3,3,56,ॐ व्यतिरेकस्तद्भावभावित्वान्न तूपलब्धिवत् ॐ,एकाधिकरणम्
3,3,57,ॐ अङ्गावबद्धास्तुन शाखासु हि प्रतिवेदनम् ॐ,अङ्गावबद्धाधिकरणम्
3,3,58,ॐ मन्त्रादिवद्वाऽविरोधः ॐ,अङ्गावबद्धाधिकरणम्
3,3,59,ॐ भूम्नःक्रतुवज्ज्यायस्त्वं तथा च दर्शयति ॐ,भूमाधिकरणम्
3,3,60,ॐ नाना शब्दादिभेदात् ॐ,नाना(शब्दा)धिकरणम्
3,3,61,ॐ विकल्पो विशिष्टफलत्वात् ॐ,विकल्पाधिकरणम्
3,3,62,ॐ काम्यास्तुयथाकामं समुच्चीयेरन्न वा पूर्वहेत्वभावात् ॐ,काम्याधिकरणम्
3,3,63,ॐ अङ्गेषु यथाऽऽश्रयाभावः ॐ,यथाश्रयभावाधिकरणम् (अङ्गाधिकरणम्)
3,3,64,ॐ शिष्टेश्च ॐ,यथाश्रयभावाधिकरणम् (अङ्गाधिकरणम्)
3,3,65,ॐ समाहारात् ॐ,यथाश्रयभावाधिकरणम् (अङ्गाधिकरणम्)
3,3,66,ॐ गुणसाधारण्यश्रुतेश्च ॐ,यथाश्रयभावाधिकरणम् (अङ्गाधिकरणम्)
3,3,67,ॐ न वाऽतत्सहभावश्रुतेः ॐ,नवाधिकरणम्
3,3,68,ॐ दर्शनाच्च ॐ,नवाधिकरणम्
3,4,1,ॐ पुरुषार्थोऽतः शब्दादिति बादरायणः ॐ,पुरुषार्थाधिकरणम्
3,4,2,ॐ शेषत्वात् पुरुषार्थवादो यथाऽन्येष्विति जैमिनिः ॐ,पुरुषार्थाधिकरणम्
3,4,3,ॐ आचारदर्शनात् ॐ,पुरुषार्थाधिकरणम्
3,4,4,ॐ तच्छ्रुतेः ॐ,पुरुषार्थाधिकरणम्
3,4,5,ॐ समन्वारम्भणात् ॐ,पुरुषार्थाधिकरणम्
3,4,6,ॐ तद्वतो विधानात् ॐ,पुरुषार्थाधिकरणम्
3,4,7,ॐ नियमाच्च ॐ,पुरुषार्थाधिकरणम्
3,4,8,ॐ अधिकोपदेशात् तु बादरायणस्यैवं तद्दर्शनात् ॐ,पुरुषार्थाधिकरणम्
3,4,9,ॐ तुल्यम् तु दर्शनम् ॐ,पुरुषार्थाधिकरणम्
3,4,10,ॐ असार्वत्रिकी ॐ,अधिकाराधिकरणम् (असार्वत्रिकाधिकरणम्)
3,4,11,ॐ विभागः शतवत् ॐ,अधिकाराधिकरणम् (असार्वत्रिकाधिकरणम्)
3,4,12,ॐ अध्ययनमात्रवतः ॐ,अधिकाराधिकरणम् (असार्वत्रिकाधिकरणम्)
3,4,13,ॐ नाविशेषात् ॐ,अधिकारविशेषाधिकरणम् (अविशेषाधिकरणम्)
3,4,14,ॐ स्तुतयेऽनुमतिर्वा ॐ,कामचाराधिकरणम् (स्तुत्यधिकरणम्)
3,4,15,ॐ कामकारेण चैके ॐ,कामचाराधिकरणम् (स्तुत्यधिकरणम्)
3,4,16,ॐ उपमर्दं च ॐ,कामचाराधिकरणम् (स्तुत्यधिकरणम्)
3,4,17,ॐ ऊर्ध्वरेतस्सु च शब्दे हि ॐ,कामचाराधिकरणम् (स्तुत्यधिकरणम्)
3,4,18,ॐ परामर्शं जैमिनिरचोदना चापवदति हि ॐ,कामचाराधिकरणम् (स्तुत्यधिकरणम्)
3,4,19,ॐ अनुष्ठेयं बादरायणः साम्यश्रुतेः ॐ,कामचाराधिकरणम् (स्तुत्यधिकरणम्)
3,4,20,ॐ विधिर्वा धारणवत् ॐ,कामचाराधिकरणम् (स्तुत्यधिकरणम्)
3,4,21,ॐ स्तुतिमात्रमुपादानादिति चेन्नापूर्वत्वात् ॐ,कामचाराधिकरणम् (स्तुत्यधिकरणम्)
3,4,22,ॐ भावशब्दाच्च ॐ,कामचाराधिकरणम् (स्तुत्यधिकरणम्)
3,4,23,ॐ पारिप्लवार्था इति चेन्न विशेषितत्वात् ॐ,कामचाराधिकरणम् (स्तुत्यधिकरणम्)
3,4,24,ॐ तथा चैकवाक्योपबन्धात् ॐ,कामचाराधिकरणम् (स्तुत्यधिकरणम्)
3,4,25,ॐ अत एव चाग्नीन्धनाद्यनपेक्षा ॐ,कामचाराधिकरणम् (स्तुत्यधिकरणम्)
3,4,26,ॐ सर्वापेक्षा च यज्ञादिश्रुतेरश्ववत् ॐ,कामचाराधिकरणम् (स्तुत्यधिकरणम्)
3,4,27,ॐ शमदमाद्युपेतः स्यात् तथाऽपितु तद्विधेस्तदङ्गतया तेषामवश्यानुष्ठेयत्वात् ॐ,कामचाराधिकरणम् (स्तुत्यधिकरणम्)
3,4,28,ॐ सर्वान्नानुमतिश्च प्राणात्यये तद्दर्शनात् ॐ,कामचाराधिकरणम् (स्तुत्यधिकरणम्)
3,4,29,ॐ अबाधाच्च ॐ,कामचाराधिकरणम् (स्तुत्यधिकरणम्)
3,4,30,ॐ अपि स्मर्यते ॐ,कामचाराधिकरणम् (स्तुत्यधिकरणम्)
3,4,31,ॐ शब्दश्चातोऽकामचारे ॐ,कामचाराधिकरणम् (स्तुत्यधिकरणम्)
3,4,32,ॐ विहितत्वाच्चाश्रमकर्मापि ॐ,कामचाराधिकरणम् (स्तुत्यधिकरणम्)
3,4,33,ॐ सहकारित्वेन च ॐ,कामचाराधिकरणम् (स्तुत्यधिकरणम्)
3,4,34,ॐ सर्वथाऽपितु त एवोभयलिङ्गात् ॐ,उभयलिङ्गाधिकरणम्
3,4,35,ॐ अनभिभवं च दर्शयति ॐ,उभयलिङ्गाधिकरणम्
3,4,36,ॐ अन्तरा चापि तु तद्दृष्टेः ॐ,उभयलिङ्गाधिकरणम्
3,4,37,ॐ अपि स्मर्यते ॐ,उभयलिङ्गाधिकरणम्
3,4,38,ॐ विशेषानुग्रहं च ॐ,उभयलिङ्गाधिकरणम्
3,4,39,ॐ अतस्त्वितरज्ज्यायोलिङ्गाच्च ॐ,उभयलिङ्गाधिकरणम्
3,4,40,ॐ तद्भूतस्य तु तद्भावो जैमिनेरपि नियमातद्रूपाभावेभ्यः ॐ,उभयलिङ्गाधिकरणम्
3,4,41,ॐ न चाधिकारिकमपि पतनानुमानात् तदयोगात् ॐ,अधिकारिकाधिकरणम्
3,4,42,ॐ उपपूर्वमपीत्येके भावशमनवत् तदुक्तम् ॐ,अधिकारिकाधिकरणम्
3,4,43,ॐ बहिस्तूभयथाऽपि स्मृतेराचाराच्च ॐ,अधिकारिकाधिकरणम्
3,4,44,ॐ स्वामिनः फलश्रुतेरित्यात्रेयः ॐ,फलश्रुत्यधिकरणम्
3,4,45,ॐ आर्त्विज्यमित्यौडुलोमिस्तस्मै हि परिक्रियते ॐ,फलश्रुत्यधिकरणम्
3,4,49,ॐ सहकार्यन्तरविधिःपक्षेण तृतीयं तद्वतो विध्यादिवत् ॐ,फलश्रुत्यधिकरणम्
3,4,47,ॐ कृत्स्नभावात् तु गृहिणोपसंहारः ॐ,कृत्स्नभावाधिकरणम्
3,4,48,ॐ मौनवदितरेषामप्युपदेशात् ॐ,कृत्स्नभावाधिकरणम्
3,4,49,ॐ अनाविष्कुर्वन्नन्वयात् ॐ,अनाविष्काराधिकरणम्
3,4,50,ॐ ऐहिकमप्रस्तुतप्रतिबन्धे तद्दर्शनात् ॐ,ऐहिकाधिकरणम्
3,4,51,ॐ एवं मुक्तिफलानियमस्तदवस्थावधृतेस्तदवस्थावधृतेः ॐ,मुक्तिफलाधिकरणम्
4,1,1,ॐ आवृत्तिरसकृदुपदेशात् ॐ,आवृत्यधिकरणम्
4,1,2,ॐ लिङ्गाच्च ॐ,आवृत्यधिकरणम्
4,1,3,ॐ आत्मेति तूपगच्छन्ति ग्राहयन्ति च ॐ,आत्मोपगमाधिकरणम्
4,1,4,ॐ न प्रतीके न हि सः ॐ,नप्रतीकाधिकरणम्
4,1,5,ॐ ब्रह्मदृष्टिरुत्कर्षात् ॐ,ब्रह्मदृष्ट्यधिकरणम्
4,1,6,ॐ आदित्यादिमतयश्चाङ्ग उपपत्तेः ॐ,आदित्यादिमत्यधिकरणम्
4,1,7,ॐ आसीनः सम्भवात् ॐ,आसनाधिकरणम्
4,1,8,ॐ ध्यानाच्च ॐ,आसनाधिकरणम्
4,1,9,ॐ अचलत्वं चापेक्ष्य ॐ,आसनाधिकरणम्
4,1,10,ॐ स्मरन्ति च ॐ,आसनाधिकरणम्
4,1,11,ॐ यत्रैकाग्रता तत्रा विशेषात् ॐ,आसनाधिकरणम्
4,1,12,ॐ आ प्रायणात् तत्रापि हि दृष्टम् ॐ,प्रायणाधिकरणम्
4,1,13,ॐ तदधिगम उत्तरपूर्वाघयोरश्लेषविनाशौ तद्व्यपदेशात् ॐ,तदधिगमाधिकरणम्
4,1,14,ॐ इतरस्याप्येवमसंश्लेषः पाते तु ॐ,तदधिगमाधिकरणम्
4,1,15,ॐ अनारब्दकार्ये एव तु पूर्वे तदवधेः ॐ,तदधिगमाधिकरणम्
4,1,16,ॐ अग्निहोत्रादि तु तत्कार्यायैव तद्दर्शनात् ॐ,तदधिगमाधिकरणम्
4,1,17,ॐ अतोऽन्यदपीत्येकेषामुभयोः ॐ,तदधिगमाधिकरणम्
4,1,18,ॐ यदेव विद्ययेति हि ॐ,तदधिगमाधिकरणम्
4,1,19,ॐ भोगेन त्वितरे क्षपयित्वाऽथ सम्पत्स्यते ॐ,तदधिगमाधिकरणम्
4,2,1,ॐ वाङ्मनसि दर्शनाच्छब्दाच्च ॐ,वाङ्मनसाधिकरणम्
4,2,2,ॐ अत एव च सर्वाण्यनु ॐ,वाङ्मनसाधिकरणम्
4,2,3,ॐ तन्मनः प्राण उत्तरात् ॐ,मनोऽधिकरणम्
4,2,4,ॐ सोऽध्यक्षे तदुपगमादिभ्यः ॐ,अध्यक्षाधिकरणम्
4,2,5,ॐ भूतेषु तच्छ्रुतेः ॐ,भूताधिकरणम्
4,2,6,ॐ नैकस्मिन् दर्शयतो हि ॐ,अनेकलयाधिकरणम् (नैकस्मिन्नधिकरणम्)
4,2,7,ॐ समना चासृत्युपक्रमादमृतत्वं चानुपोष्य ॐ,समनाधिकरणम्
4,2,8,ॐ तदपीतेः संसारव्यपदेशात् ॐ,समनाधिकरणम्
4,2,9,ॐ सूक्ष्मं प्रमाणतश्च तथोपलब्देः ॐ,समनाधिकरणम्
4,2,10,ॐ नोपमर्देनातः ॐ,समनाधिकरणम्
4,2,11,ॐ अस्यैव चोपपत्तेरूष्मा ॐ,समनाधिकरणम्
4,2,12,ॐ प्रतिषेधादिति चेन्न शारीरात् ॐ,समनाधिकरणम्
4,2,13,ॐ स्पष्टो ह्येकेषाम् ॐ,समनाधिकरणम्
4,2,14,ॐ स्मर्यते च ॐ,समनाधिकरणम्
4,2,15,ॐ तानि परे तथा ह्याह ॐ,परा(लया)धिकरणम्
4,2,16,ॐ अविभागो वचनात् ॐ,अविभागाधिकरणम्
4,2,17,ॐ तदोकोऽग्रज्वलनं तत्प्रकाशितद्वारो विद्यासामर्थ्यात् तच्छेषगत्यनुस्मृतियोगाच्च हार्दानुगृहीतः शताधिकया ॐ,हृदयाग्रज्वलना(तदोकोऽ)धिकरणम्
4,2,18,ॐ रश्म्यनुसारी ॐ,हृदयाग्रज्वलना(तदोकोऽ)धिकरणम्
4,2,19,ॐ निशि नेति चेन्न सम्बन्धात् ॐ,हृदयाग्रज्वलना(तदोकोऽ)धिकरणम्
4,2,20,ॐ यावद्देहभावित्वाद्दर्शयति च ॐ,हृदयाग्रज्वलना(तदोकोऽ)धिकरणम्
4,2,21,ॐ अतश्चायनेऽपि हि दक्षिणे ॐ,हृदयाग्रज्वलना(तदोकोऽ)धिकरणम्
4,2,22,ॐ योगिनः प्रति स्मर्येते स्मार्ते चैते ॐ,प्रतिस्मरणाधिकरणम् (योग्यधिकरणम्)
4,3,1,ॐ अर्चिरादिना तत्प्रथितेः ॐ,अर्चिराद्यधिकरणम्
4,3,2,ॐ वायुशब्दादविशेषविशेषाभ्याम् ॐ,वायुगत्यधिकरणम्
4,3,3,ॐ तटितोऽधिवरुणः सम्बन्धात् ॐ,तटिदधिकरणम्
4,3,4,ॐ आतिवाहिकस्तल्लिङ्गात् ॐ,अतिवाहिकाधिकरणम्
4,3,5,ॐ उभयव्यामोहत् तत्सिद्धेः ॐ,अतिवाहिकाधिकरणम्
4,3,6,ॐ वैद्युतेनैव ततस्तच्छ्रुतेः ॐ,वैद्युताधिकरणम्
4,3,7,ॐ कार्यं बादरिरस्यगत्युपपत्तेः ॐ,कार्याधिकरणम्
4,3,8,ॐ विशेषितत्वाच्च ॐ,कार्याधिकरणम्
4,3,9,ॐ सामीप्यात्तुतद्व्यपदेशः ॐ,कार्याधिकरणम्
4,3,10,ॐ कार्यात्यये तदध्यक्षेण सहातः परमभिधानात् ॐ,कार्याधिकरणम्
4,3,11,ॐ स्मृतेश्च ॐ,कार्याधिकरणम्
4,3,12,ॐ परं जैमिनिर्मुख्यत्वात् ॐ,कार्याधिकरणम्
4,3,13,ॐ दर्शनाच्च ॐ,कार्याधिकरणम्
4,3,14,ॐ न च कार्ये प्रतिपत्त्यभिसन्धिः ॐ,कार्याधिकरणम्
4,3,15,ॐ अप्रतीकालम्बनान् नयतीति बादरायण उभयथा च दोषात् तत्क्रतुश्च ॐ,कार्याधिकरणम्
4,3,16,ॐ विशेषं च दर्शयति ॐ,कार्याधिकरणम्
4,4,1,ॐ सम्पद्याविहाय स्वेन शब्दात् ॐ,सम्पद्याधिकरणम्
4,4,2,ॐ मुक्तः प्रतिज्ञानात् ॐ,मुक्ताधिकरणम्
4,4,3,ॐ आत्मा प्रकरणात् ॐ,आत्माधिकरणम्
4,4,4,ॐ अविभागेन दृष्टत्वात् ॐ,अविभागाधिकरणम्
4,4,5,ॐ ब्राह्मेण जैमिनिरुपन्यासादिभ्यः ॐ,चितिमात्राधिकरणम् (ब्रह्माधिकरणम्)
4,4,6,ॐ चितिमात्रेण तदात्मकत्वादित्यौडुलोमिः ॐ,चितिमात्राधिकरणम् (ब्रह्माधिकरणम्)
4,4,7,ॐ एवमप्युपन्यासात् पूर्वभावादविरोधं बादरायणः ॐ,चितिमात्राधिकरणम् (ब्रह्माधिकरणम्)
4,4,8,ॐ सङ्कल्पादेव च तच्च्रुतेः ॐ,सङ्कल्पाधिकरणम्
4,4,9,ॐ अत एव चानन्याधिपतिः ॐ,अनन्याधिपतित्वाधिकरणम्
4,4,10,ॐ अभावं बादरिराह ह्येवम् ॐ,उभयविधभोगाधिकरणम्
4,4,11,ॐ भावं जैमिनिर्विकल्पाम्नानात् ॐ,उभयविधभोगाधिकरणम्
4,4,12,ॐ द्वादशाहवदुभयविधं बादरायणोऽतः ॐ,उभयविधभोगाधिकरणम्
4,4,13,ॐ तन्वभावे सन्ध्यवदुपपत्तेः ॐ,उभयविधभोगाधिकरणम्
4,4,14,ॐ भावे जाग्रद्वत् ॐ,उभयविधभोगाधिकरणम्
4,4,15,ॐ प्रदीपवदावेशस्तथा हि दर्शयति ॐ,उभयविधभोगाधिकरणम्
